category,title,tags,age_rating,rating_description,description,representation,image,duration_txt,duration_sec,first_broadcast,synopsis_small,synopsis_medium,synopsis_large
Science & Nature,Arctic with Bruce Parry - 2. Greenland,"BBC, iPlayer, TV, Arctic with Bruce Parry, 2. Greenland",12,mild language,"Bruce Parry meets the last traditional Inuit hunters, in northern Greenland.",3.0,https://ichef.bbci.co.uk/images/ic/1200x675/p09jntf3.jpg,59 mins,3549,9pm 9 Jan 2011,"Bruce Parry meets the last traditional Inuit hunters, in northern Greenland.","Bruce Parry journeys to the far north of Greenland, home to the last traditional Inuit hunters, and learns how climate change is threatening their ancient way of life.","Bruce Parry journeys to the far north of Greenland, home to the last traditional Inuit hunters. Bruce experiences the realities of life - and death - on a seal hunt, and learns how climate change is threatening their ancient way of life. But while global warming is causing problems for the hunters, it is providing others with new opportunities. As the vast Greenland ice sheet melts, new mineral riches are being revealed. Bruce works with a mining team who are about to strike it big. Greenland is changing fast - but will there still be a place for hunters in the Arctic of the twenty-first century?"
Science & Nature,Click - Short Edition - 04/12/2021,"BBC, iPlayer, TV, Click - Short Edition, 04/12/2021",U,clean,"A guide to all the latest gadgets, websites, games and computer industry news.",1.0,https://ichef.bbci.co.uk/images/ic/1200x675/p0b7zc00.jpg,12 mins,715,3:30am 4 Dec 2021,"A guide to all the latest gadgets, websites, games and computer industry news.","A comprehensive guide to all the latest gadgets, websites, games and computer industry news.","A comprehensive guide to all the latest gadgets, websites, games and computer industry news."
Science & Nature,Serengeti II - Series 1: 5. Power,"BBC, iPlayer, TV, Serengeti II, Series 1: 5. Power",U,animal hunting,Power is shifting among the families as their young are growing and new threats emerge.,,https://ichef.bbci.co.uk/images/ic/1200x675/p09sjs44.jpg,58 mins,3480,22 Aug 2021,Power is shifting among the families as their young are growing and new threats emerge.,"Power is shifting among the animal families as new threats emerge. As their young grow and everyone fights to survive, who will be the winners and losers?","For Kali, the threat from Sefu has been replaced with a far bigger threat from the black-maned males. Will she never stop living in fear? Duma is growing up fast, but when he tries to take on the vultures, he ends up alone and lost. With Kali roaming nearby, it’s a dangerous time to be without his mother. Bakari struggles to exert his power over the intruder males. He tries to calm things down by taking his troop on a gazelle hunt, but when he fails to catch Tamu, his position in the troop starts to look precarious. He comes up with a plan to steal from Aiysha and her cubs, but will it be enough to win back his throne?Duma is still searching for his family, but instead is found by a group of male cheetahs. He tries to join their gang but is too young to be accepted. Once again, he is lost and alone, facing many dangers. Unable to catch food by himself, his only hope is to find his family.When Zalika finally finds a way to reunite her clan, she has the power to take revenge on Kali. But Askari, the black-maned male, is more powerful than ever and comes to Kali’s rescue. Why has he suddenly become her ally? Tamu and his mother are in constant danger, not least from the black-maned lions. But when the unthinkable happens, is Tamu brave enough to defend himself against so many predators?The great herds are gathering, and Shani’s foal and Gnu are growing up. It’s time to visit the huge river for the first time. Excitement aside, there are dangers lurking beneath the surface, just when everyone is desperate to quench their thirst.Storyteller Lupita Nyong'oCreated & Produced by Simon FullerDirected & Produced by John Downer"
Science & Nature,Planet Earth II - 4. Deserts,"BBC, iPlayer, TV, Planet Earth II, 4. Deserts",U,animal hunting,The incredible ways in which animals cope with living in the planets deserts.,,https://ichef.bbci.co.uk/images/ic/1200x675/p04hbfgn.jpg,58 mins,3485,27 Nov 2016,The incredible ways in which animals cope with living in the planet's deserts.,"The world's deserts force animals to come up with ingenious ways of coping with hostile conditions, giving rise to the most incredible survival stories on earth.","The world's deserts are lands of extremes that force animals to come up with ingenious ways of coping with hostile conditions, giving rise to the most incredible survival stories on earth. A pride of desert lions are so hungry they risk hunting a giraffe several times their size, while male sandgrouse fly 120 miles each day to the nearest waterhole and dice with death to collect water for their chicks. Filmed for the first time, a tiny bat does battle with one of the world's deadliest scorpions, and in Madagascar, a locust swarm of biblical proportions is seen as never before."
Science & Nature,Planet Earth - 2. Mountains,"BBC, iPlayer, TV, Planet Earth, 2. Mountains",U,animal hunting,"A look at mountains, from their origins at earths lowest places to the summit of Everest.",,https://ichef.bbci.co.uk/images/ic/1200x675/p05ccrb2.jpg,58 mins,3452,12 Mar 2006,"A look at mountains, from their origins at earth's lowest places to the summit of Everest.","Documentary series which celebrates earth in all its glory. This edition looks at mountains, beginning with the birth of a mountain and ending at the summit of Everest.","Humans like to think that once they have climbed a mountain, they have somehow conquered it. But they can only ever be visitors to this alien, frozen world. Planet Earth takes you on a tour of its mightiest ranges, beginning with the birth of a mountain at one of the lowest places on earth, and ending at the summit of Everest. Unprecedented access brings you closer than ever before to the most awe-inspiring mountain landscapes on our planet and the secretive, almost mythical creatures that inhabit them - the 'real' mountaineers. In Ethiopia, Planet Earth ventures into the heart of a volcano to discover one of earth's rarest phenomena - a lava lake that has been erupting for over 100 years. The same forces created Ethiopia's Simien Mountains, home to troops of gelada baboons nearly a thousand strong. In the Andes, a family of five puma struggle to survive the most unstable mountain weather on the planet. Experience the full force of an avalanche in the Rockies, where grizzlies survive the harsh winters deep inside the dangerous slopes. In summer, the bears climb the peaks in search of moths, which they devour by the thousand.Descend into the icy core of a glacier in the Alps and emerge in Pakistan, at the snout of the largest glacier on earth. This realm of giant peaks is home to the highest land predator on the planet - the snow leopard. Astounding images of a female snow leopard hunting to feed her cub are a world first.Enter a mountain cave in China for the first ever glimpse of a wild giant panda mother nursing her week-old baby and fly alongside demoiselle cranes as they attempt to cross the largest range on our planet, the Himalayas. The cranes, like all visitors to the hostile world of the high mountains, dare not linger."
Science & Nature,The Sky at Night - Neptune: Voyager's Last Planet,"BBC, iPlayer, TV, The Sky at Night, Neptune: Voyagers Last Planet",PG,upsetting scenes,Voyager 2 has been sending back remarkable new information about Neptune. (1989),,https://ichef.bbci.co.uk/images/ic/1200x675/p02x7w0h.jpg,34 mins,2061,10 Sep 1989,Voyager 2 has been sending back remarkable new information about Neptune. (1989),"Voyager 2 has now passed Neptune, sending back remarkable new information about this distant planet. Patrick Moore and guests summarise what has been discovered. (1989)","Voyager 2, launched in 1977, has already passed by the giant planets Jupiter, Saturn and Uranus, all of which have provided plenty of surprises. Voyager has now passed Neptune, sending back remarkable new information about the outermost planet.Patrick Moore is joined by Dr Garry Hunt and other experts from the American team to summarise what has been discovered about this lonely, remote world. (1989)"
Science & Nature,A Perfect Planet - Series 1: 5. Humans,"BBC, iPlayer, TV, A Perfect Planet, Series 1: 5. Humans",,clean,"Humans are changing our planet so rapidly, it’s affecting earth’s life support systems.",3.0,https://ichef.bbci.co.uk/images/ic/1200x675/p092423y.jpg,58 mins,3484,3 Jan 2021,"Humans are changing our planet so rapidly, it’s affecting earth’s life support systems.","Humans are changing our planet so rapidly, it’s affecting earth’s life support systems: our weather, our oceans and the living world.","Earth is the only living world we know of, but a new force threatens our perfect planet. That force is us. Humans are changing our planet so rapidly, it’s affecting earth’s life support systems: our weather, our oceans and the living world. To understand what is going wrong, we must look to the past. Earth has been through at least five mass extinction events, most of which have been caused by cataclysmic volcanic eruptions. It’s not the lava or ash that wiped out life, but an invisible gas released by volcanoes: carbon dioxide. Through compelling animal-led stories and expert interviews, we discover how CO2 is destabilising our planet. We meet rescued orphaned elephants in Kenya, victims of ever worsening droughts, and join ocean patrols off the coast of Gabon fighting to save endangered sharks. In the Amazon, we witness wildlife teams saving animals in the shrinking forests, and in San Diego we enter a cryogenic zoo preserving the DNA of endangered species before they become extinct. Almost every part of modern life depends on energy created by burning fossil fuels, and this produces CO2 in huge amounts. Humans are now acting like a super-volcano, releasing carbon dioxide at an even greater rate than the prehistoric mega-eruptions that extinguished life in the past. Globally, we now release 100 times more carbon dioxide into the atmosphere than all of Earth's volcanoes combined.The greatest change to be made is in how we create energy, and the planet is brimming with natural power that can help us do just that. It’s these forces of nature - the wind, the sun, waves and geothermal energy - that hold the key to our future."
Science & Nature,Natural World - 2008-2009: 3. Clever Monkeys,"BBC, iPlayer, TV, Natural World, 2008-2009: 3. Clever Monkeys",,clean,David Attenborough discovers some surprisingly human behaviour when he looks at monkeys.,,https://ichef.bbci.co.uk/images/ic/1200x675/p01g88tk.jpg,49 mins,2925,8pm 25 Nov 2008,David Attenborough discovers some surprisingly human behaviour when he looks at monkeys.,"David Attenborough discovers some surprisingly human behaviour when he looks at monkeys, such as pygmy marmosets, bearded capuchins or white-faced capuchins.","David Attenborough's entertaining romp through the world of monkeys has a serious side: for when we look at monkeys, we can see ourselves. From memory to morality, from 'crying wolf' to politics, monkeys are our basic blueprint. Pygmy marmosets 'farm' tree sap bearded capuchins in Brazil develop a production line for extracting palm nuts white-faced capuchins in Costa Rica tenderly nurse the victims of battle and in the Ethiopian highlands, a deposed gelada baboon has got the blues.Cheating, lying and bare-faced murder are all there too. These revelations of simian science, combined with captivating photography, make this film about monkey business our business."
Science & Nature,Arctic with Bruce Parry - 4. Canada,"BBC, iPlayer, TV, Arctic with Bruce Parry, 4. Canada",12,mild language,Bruce travels to the far north of Canada to live with the Caribou people.,1.0,https://ichef.bbci.co.uk/images/ic/1200x675/p09jnt3k.jpg,59 mins,3568,26 Apr 2011,Bruce travels to the far north of Canada to live with the Caribou people.,Bruce travels to the far north of Canada to live with the Caribou people and witness their annual spring hunt. He then heads south to the tar sands of Alberta.,"Bruce travels to the far north of Canada to live with the Caribou people and witness their annual spring hunt. The Gwitchin tribe has hunted migrating caribou in the Arctic wilderness for thousands of years, but this tradition is now under threat from oil exploration. Bruce then heads south to the tar sands of Alberta, home to the second largest oil reserves in the world, to discover how native people cope when the oil industry moves into their territory."
Science & Nature,Zoo Quest - Zoo Quest for a Dragon: 3. Java,"BBC, iPlayer, TV, Zoo Quest, Zoo Quest for a Dragon: 3. Java",PG,infrequent mild bad language,"Continuing his adventures in Indonesia, David Attenborough visits Java. (1956)",3.0,https://ichef.bbci.co.uk/images/ic/1200x675/p01hz6yh.jpg,24 mins,1460,8:15pm 19 Oct 1956,"Continuing his adventures in Indonesia, David Attenborough visits Java. (1956)","First transmitted in 1956, David Attenborough and his cameraman Charles Lagus explore the island of Java in their quest for the largest lizard in the world.","First transmitted in 1956, David Attenborough and his cameraman Charles Lagus explore the island of Java in their quest for the largest lizard in the world.They see gibbons having a leisurely breakfast in the treetops, stop off at the 8th century Buddhist temple Borobudur and take a glimpse into Bromo, a sulphur-spewing volcano.Attenborough also captures a fully grown python to bring back to London Zoo. This creature later makes a wriggly appearance as a guest in the studio."
Science & Nature,Frozen Planet - 2. Spring,"BBC, iPlayer, TV, Frozen Planet, 2. Spring",PG,animal hunting,"Spring arrives in the polar regions, and the sun appears after an absence of five months.",,https://ichef.bbci.co.uk/images/ic/1200x675/p01h6jw0.jpg,58 mins,3463,2 Nov 2011,"Spring arrives in the polar regions, and the sun appears after an absence of five months.","Documentary series. It's spring in the polar regions and, after a five-month absence, the sun reappears. The greatest seasonal transformation on our planet is under way.","Spring arrives in the polar regions, and the sun appears after an absence of five months warmth and life return to these magical ice worlds - the greatest seasonal transformation on our planet is under way.Male adelie penguins arrive in Antarctica to build their nests - it takes a good property to attract the best mates and the males will stop at nothing to better their rivals. But these early birds face the fiercest storms on the planet.In the Arctic, a polar bear mother is hunting with her cubs. Inland, the frozen rivers start to break up and billions of tons of ice are swept downstream in the greatest of polar spectacles. This meltwater fertilizes the Arctic Ocean, feeding vast shoals of Arctic cod and narwhal. The influx of freshwater accelerates the breakup of the sea ice - an area of ice the size of Australia will soon vanish from the Arctic.On land, a woolly bear caterpillar emerges from the snow having spent the winter frozen solid. Caterpillars normally become moths within months of hatching, but life is so harsh here that the woolly bear takes 14 years to reach adulthood. Once mature, it has only days to find a mate before it dies. Alongside the caterpillars, white arctic wolves race to raise their adorable cubs before the cold returns.In Antarctica, vast numbers of seabirds arrive on South Georgia joining the giant albatross and king penguins that have been there all winter. Elephant seals fight furious battles over females on a beach that contains the greatest mass of animals on the planet.Finally, the female adelie penguins arrive, chased from the water by killer whales. Mating and chick rearing lie ahead of them."
Science & Nature,Blue Planet II - Series 1: 6. Coasts,"BBC, iPlayer, TV, Blue Planet II, Series 1: 6. Coasts",U,animal hunting,"Coasts are the most changeable of the ocean worlds, but they offer great riches.",,https://ichef.bbci.co.uk/images/ic/1200x675/p05pffv5.jpg,58 mins,3462,3 Dec 2017,"Coasts are the most changeable of the ocean worlds, but they offer great riches.","The wildlife series narrated by David Attenborough explores the planet's coasts. They are the most changeable of the ocean worlds, but they offer great riches.","On the coast, two worlds collide. Coasts are the most dynamic and challenging habitats in the ocean - that brings great rewards but also great danger. The extraordinary animals that live here must find ingenious ways to cope with two very different worlds.This episode is a rollercoaster ride of heart-stopping action and epic drama, peopled with characters from the beautiful to the bizarre. We meet fish that live on dry land and puffins that must travel 60 miles or more for a single meal, and witness a life-and-death struggle in a technicolour rock pool.In a secluded cove in the Galapagos, sea lions feast on 60kg tuna. It should be impossible - tuna are usually far too fast for sea lions to catch. But here the sea lions club together to herd their prey inshore. Once trapped in the shallows, these huge fish are easy pickings.As the tide recedes in Brazil, lightfoot crabs leap from rock to rock, desperately avoiding the water - their lives depend on it. Moray eels launch themselves from rock pools, jaw gaping. Then octopuses, too. Both crawl across dry rock to set their ambush. Elsewhere, the ever-changing tides create rock pools. But these temporary worlds are a battleground. Predatory starfish turn a magical garden into the stuff of nightmares. All around the world, immense waves pound the shore, and this episode reveals some of the largest on the planet, over 30 metres high. Over millennia these forces carve exquisite coastal sculptures and cliffs that are home to huge colonies of seabirds. Puffins fly up to 30 miles out to sea to find food for their chicks. A father returns with one precious beakful of food... then pirates attack. Desperate dads must escape the faster and more aerobatic skuas before finally delivering a meal to their young puffling.Meanwhile, in the remote Pacific islands lives the most terrestrial fish on the planet. It lives in miniature caves above the tide lines and uses its tail like a coiled spring to jump from rock to rock. A male tries to attract a mate, but waves are a constant hindrance. These are fish that seem to hate water!Once a year, king penguins return to the cold Antarctic shores of South Georgia for a month-long moult. First they must cross the biggest wall of blubber on the planet - thousands of gigantic elephant seals. Then they face a month with no food, before they can return to their natural home, the chilly Antarctic seas. The planet's coasts are changing fast as they are among the most built-up areas of the world. Just off the beaches of Miami, the largest gathering of coastal sharks on the planet can still be found. But today they must face the many challenges that come from our world too."
Science & Nature,The Green Planet - Series 1: 1. Tropical Worlds,"BBC, iPlayer, TV, The Green Planet, Series 1: 1. Tropical Worlds",U,clean,"The world of tropical forests, from fast-growing trees to flowers that mimic dead animals.",,https://ichef.bbci.co.uk/images/ic/1200x675/p0bd8hrz.jpg,59 mins,3525,9 Jan 2022,"The world of tropical forests, from fast-growing trees to flowers that mimic dead animals.",Tropical rainforests are plant battlegrounds. New filming techniques allow us to enter the world of plants to see it from their perspective and on their timescale.,"More kinds of plants are crammed together in the tropical rainforests than anywhere else on Earth. The result is astonishing beauty and intense competition - a plant battleground. New filming techniques allow us to enter the plants’ world and see it from their perspective and on their timescale. From fast-growing trees to flowers that mimic dead animals, this is a journey into a magical world that operates on a different timescale to our own."
Science & Nature,Great Barrier Reef - 3. Reef and Beyond,"BBC, iPlayer, TV, Great Barrier Reef, 3. Reef and Beyond",U,clean,A look at the creatures who travel for thousands of miles to visit the reefs warm waters.,,https://ichef.bbci.co.uk/images/ic/1200x675/p08zg4th.jpg,59 mins,3546,8:10pm 15 Jan 2012,A look at the creatures who travel for thousands of miles to visit the reef's warm waters.,Monty Halls explores Australia's natural wonder. The Great Barrier Reef is vitally linked to the rest of the planet and creatures travel thousands of miles to visit.,"The Great Barrier Reef is vitally linked to the rest of the planet in many ways. Creatures travel for thousands of miles to visit in spectacular numbers, including tiger sharks, great whales, sea birds and the largest green turtle gathering on earth. Alien creatures that are rarely seen, like nautilus, also rise out of the deep to visit the reef's warm waters. Weather systems travelling from across the Pacific also affect the whole reef, including mighty cyclones that bring destruction and chaos to the coral and the creatures that live on it. And it is weather patterns and climate change on a global scale that are likely to shape the future of the Great Barrier Reef and all its wildlife."
Science & Nature,The Green Planet - Series 1: 5. Human Worlds,"BBC, iPlayer, TV, The Green Planet, Series 1: 5. Human Worlds",U,clean,"Two out of five plants are threatened, but people are finding many new ways to help them.",3.0,https://ichef.bbci.co.uk/images/ic/1200x675/p0blrlcb.jpg,58 mins,3450,6 Feb 2022,"Two out of five plants are threatened, but people are finding many new ways to help them.","Two out of five wild plants are threatened with extinction. Today people are finding remarkable ways to help them, and so make our world a little greener and a little wilder.","We rely on plants for almost everything, including the air we breathe and the food we eat. Two in five wild plants are threatened with extinction, but people are finding new ways to help them, from projects in Africa to reseed the landscape to the rebuilding of a tropical forest in Brazil, tree by tree."
Science & Nature,Aquarela,"BBC, iPlayer, TV, Aquarela",12,distressing scene,A cinematic journey through the transformative beauty and raw power of water.,,https://ichef.bbci.co.uk/images/ic/1200x675/p09ss26y.jpg,82 mins,4939,25 Aug 2021,A cinematic journey through the transformative beauty and raw power of water.,A cinematic journey through the transformative beauty and raw power of water and a wake-up call for humankind that we are no match for the force and will of earth’s most precious element.,"A cinematic journey through the transformative beauty and raw power of water that provides a visceral wake-up call for humankind that we are no match for the sheer force and capricious will of earth’s most precious element. From the precarious frozen waters of Russia’s Lake Baikal to Miami in the throes of Hurricane Irma to Venezuela’s mighty Angel Falls, water’s many personalities are captured in startling cinematic clarity."
Science & Nature,Zoo Quest - Zoo Quest for a Dragon: 5. Bali - Part Two,"BBC, iPlayer, TV, Zoo Quest, Zoo Quest for a Dragon: 5. Bali - Part Two",PG,infrequent mild bad language,David Attenborough encounters scaly anteaters as his expedition continues in Bali. (1956),3.0,https://ichef.bbci.co.uk/images/ic/1200x675/p01hz7pg.jpg,30 mins,1789,8:15pm 2 Nov 1956,David Attenborough encounters scaly anteaters as his expedition continues in Bali. (1956),"First transmitted in 1956, the Zoo Quest team wander off the beaten track on the beautiful island of Bali, encountering curious villagers and remarkable creatures.","First transmitted in 1956, David Attenborough walks through avenues of palm trees and rice fields in order to reach a small Balinese village.Once there, he encounters curious villagers and remarkable creatures, including ants that demonstrate some ingenious behaviour.In addition to exploring less celebrated wildlife, this is also an opportunity to witness the unique Balinese culture with its hypnotic music and dance based on ancient Hindu legends."
Science & Nature,Planet Earth II - 3. Jungles,"BBC, iPlayer, TV, Planet Earth II, 3. Jungles",U,animal hunting,A look at the animals competing to survive in the rich habitats of the planets jungles.,,https://ichef.bbci.co.uk/images/ic/1200x675/p04gblmy.jpg,58 mins,3479,20 Nov 2016,A look at the animals competing to survive in the rich habitats of the planet's jungles.,Jungles provide the richest habitats on the planet - mysterious worlds of high drama where extraordinary animals attempt to survive in the most competitive place on earth.,"Jungles provide the richest habitats on the planet - mysterious worlds of high drama where extraordinary animals attempt to survive in the most competitive place on earth. Flooded forests are home to caiman-hunting jaguars and strange dolphins that swim amongst the tree tops, while in the dense underworld, ninja frogs fight off wasps and flying dragons soar between trees. Acrobatic indri leap through the forests of Madagascar, while the jungle night conceals strange fungi and glow-in-the-dark creatures never filmed before."
