category,title,tags,age_rating,rating_description,description,representation,image,duration_txt,duration_sec,first_broadcast,synopsis_small,synopsis_medium,synopsis_large
Science & Nature,Extra Life: A Short History of Living Longer - Series 1: 2. Medical Drugs,"BBC, iPlayer, TV, Extra Life: A Short History of Living Longer, Series 1: 2. Medical Drugs",,clean,How antibiotics and antiviral drugs underpin efforts to find treatments for new diseases.,1.0,https://ichef.bbci.co.uk/images/ic/1200x675/p09hsz62.jpg,53 mins,3186,10pm 25 May 2021,How antibiotics and antiviral drugs underpin efforts to find treatments for new diseases.,Documentary series about the effect of medicine on life expectancy. How knowledge gained from the discovery of antibiotics and antiviral drugs underpins efforts to find treatments for new diseases.,"Inventions that combat illness directly are relatively recent breakthroughs in humanity’s fight against life-shortening disease. In this episode, Steven Johnson and David Olusoga explore the remarkable and often unsung work that has led to major medical advances.Alexander Fleming's famous discovery of antibiotics was followed – in the midst of World War II – by the rollout of the manufacture of penicillin at scale, so that lives might be saved at a global level. Pioneering rational drug design in the 1980s led to the development of antiviral drugs for HIV and other previously untreatable diseases.This knowledge – how to produce safe, effective drugs – now underpins efforts to find treatments for new diseases, such as Covid-19, today."
Science & Nature,The Mating Game - Series 1: 4. Freshwater: Timing Is Everything,"BBC, iPlayer, TV, The Mating Game, Series 1: 4. Freshwater: Timing Is Everything",PG,"animal fighting, mild threat, sex references, upsetting scenes",The cycle of freshwater triggers spectacular mating rituals and fierce competition.,,https://ichef.bbci.co.uk/images/ic/1200x675/p09z41sr.jpg,58 mins,3476,8pm 24 Oct 2021,The cycle of freshwater triggers spectacular mating rituals and fierce competition.,"Freshwater is often the stage on which millions of animals gather to find a mate, and the cycle of freshwater is the trigger for spectacular mating rituals and fierce competition.","Freshwater covers only a tiny fraction of the earth’s surface, but it is a vital meeting place for many animals - the stage on which millions gather to find a mate. Yet with so little of it available, and often only briefly, the challenge for most individuals is how to overcome intense competition when your rivals are just as dependent on the precious freshwater for their success. Whether it is from melting ice, torrential rain or shrinking wetlands, the cycle of freshwater is the trigger for spectacular mating rituals and fierce combat.The start of the rains in South Africa triggers a violent battle between male giant African bullfrogs. Rare hooded grebes in Patagonia perform one of nature’s more comical dances to seduce their partner, and a male cichlid fish builds a home for his harem from old snail shells, but a sneaky dwarf has the last laugh there.The mating season for animals that live in freshwater is often determined by when is best for their new offspring - even if that moment is far from ideal for the parents. In the wetlands of Zambia, female lechwe antelope search for the strongest males while contending with drought, and in the Pantanal of Brazil at the end of the dry season, caimans congregate in huge numbers around the last remaining water to perform their spectacular displays.For all those dependent on the cycle of freshwater to breed, timing is everything."
Science & Nature,Born to Be Wild - Series 2: Episode 1,"BBC, iPlayer, TV, Born to Be Wild, Series 2: Episode 1",12,dangerous behaviour,A look behind the scenes at the Scottish SPCA’s National Wildlife Rescue Centre.,1.0,https://ichef.bbci.co.uk/images/ic/1200x675/p09tydh2.jpg,58 mins,3480,8pm 19 Jul 2021,A look behind the scenes at the Scottish SPCA’s National Wildlife Rescue Centre.,"April helps hand-rear Padme the orphaned fox cub, while in the seal unit, Kaniz needs the help of specialist vet Romain to operate on a grey seal with a swollen flipper.","It’s the start of spring at the SSPCA Wildlife Rescue Centre – the place where orphaned and injured wild animals from all over Scotland find help from a dedicated team of vets and carers.Former wildlife assistant April has been newly promoted to the head of the large mammals section and, with the other team members, she anxiously awaits the influx of orphans that accompanies the arrival of March each year. The first orphans to arrive are nearly always fox cubs and this year is no different, with a lone cub soon arriving.The team decide on a Star Wars theme for this year’s fox names, and soon April is hand-rearing little Solo, with many others such as female cub Padme close behind. Solo thrives, but Padme manages to injure her leg trying to leap out of her enclosure. Luckily, specialist vet Romain is on hand to repair the damaged leg, and all the foxes are eventually returned to the wild.In the seal unit, Kaniz is confronted by a dilemma with grey seal Concentration, who appears to have an inflamed flipper. Once again it’s down to miracle-worker Romain to heal the seal with the help of specialist surgery and a hi-tech, heat-sensitive camera."
Science & Nature,Shark - Episode 3,"BBC, iPlayer, TV, Shark, Episode 3",15,scenes of animal threat,An international team of scientists is trying to change perceptions of sharks.,,https://ichef.bbci.co.uk/images/ic/1200x675/p02r49lt.jpg,58 mins,3480,9pm 21 May 2015,An international team of scientists is trying to change perceptions of sharks.,"Wildlife series on the sharks of the world. Sharks are among the most misunderstood predators on the planet, but a team of scientists is trying to change that.","Sharks are among the most misunderstood predators on the planet, but an international team of scientists is trying to change that. Their research is revealing that sharks can be sociable and intelligent, and they could even help solve some of the toughest medical challenges of the 21st century. However, their breakthroughs come just as many sharks face extinction. Science may now be the only way to save them."
Science & Nature,Greta Thunberg: A Year to Change the World - Series 1: Episode 2,"BBC, iPlayer, TV, Greta Thunberg: A Year to Change the World, Series 1: Episode 2",U,clean,"Greta sets off to the annual World Economic Forum in Davos, Switzerland.",1.0,https://ichef.bbci.co.uk/images/ic/1200x675/p09cysgd.jpg,58 mins,3477,12 Apr 2021,"Greta sets off to the annual World Economic Forum in Davos, Switzerland.","Greta sets off to the annual World Economic Forum in Davos, Switzerland.","Greta sets off to the annual World Economic Forum in Davos, Switzerland, which will be attended by US president Donald Trump and other world leaders, to call for action on climate change. Greta is demanding an immediate reduction in fossil fuel use - one of the main drivers of climate change. As she travels across Europe, Greta finds out what is preventing more rapid action to tackle global warming. She meets Polish miners who have lost their jobs and fear that climate change policies will further decimate their industry and culture. In Davos, she is frustrated by what she sees as a media obsession constantly pitting her against President Trump. Greta also travels to the UK to see the prototype of a technology that aims to lower emissions from industry by capturing carbon dioxide from factory emissions before it enters the atmosphere. She also meets with a figure who’s been an inspiration to her, Sir David Attenborough."
Science & Nature,Forces of Nature with Brian Cox - 3. The Moth and the Flame,"BBC, iPlayer, TV, Forces of Nature with Brian Cox, 3. The Moth and the Flame",U,clean,Professor Brian Cox investigates the ingredients which are the building blocks of life.,1.0,https://ichef.bbci.co.uk/images/ic/1200x675/p041fmxw.jpg,58 mins,3501,18 Jul 2016,Professor Brian Cox investigates the ingredients which are the building blocks of life.,"Professor Brian Cox reveals how Earth's beauty is created by just a handful of forces. In this episode, he investigates the building blocks of life.","Professor Brian Cox shows how Earth's basic ingredients, like the pure sulphur mined in the heart of a deadly volcano in Indonesia, have become the building blocks of life. Hidden deep in a cave in the Dominican Republic lies a magical world created by the same property of water that makes it essential to life. Clinging to a precipitous dam wall in Italy, baby mountain goats seek out Earth's chemical elements essential to their survival. In the middle of the night in a bay off Japan, Brian explains how the dazzling display of thousands of glowing squid shows how life has taken Earth's chemistry and turned it into the chemistry of life."
Science & Nature,Fantastic Beasts: A Natural History,"BBC, iPlayer, TV, Fantastic Beasts: A Natural History",PG,"mild fantasy violence, injury detail",Stephen Fry discovers the fascinating stories behind the world’s most fantastic beasts.,1.0,https://ichef.bbci.co.uk/images/ic/1200x675/p0bpqpn6.jpg,58 mins,3476,7pm 27 Feb 2022,Stephen Fry discovers the fascinating stories behind the world’s most fantastic beasts.,Stephen Fry uncovers the stories behind the world’s most fantastic beasts - from dragons to unicorns - revealing the real-life animals behind the greatest legends in history.,"Stephen Fry embarks on a fascinating journey to discover the stories behind some of the world’s most fantastic beasts.Mythical creatures have fascinated us for thousands of years, but why are we still captivated by these mythological beasts, even in this modern age of science and technology? With the help of scientists, historians, writers and film-makers, Stephen finds out why the world of magical animals is more popular today than ever before.By digging for dragons, meeting distant relatives of the unicorn or swimming with an unlikely inspiration for mermaids, Stephen uncovers the secrets behind some of our best-loved mythical creatures, and reveals the real-life beasts that have inspired some of the greatest legends in history, from rhinos to narwhals, vervet monkeys to manatees.  These are the stories of the world’s most fantastic beasts."
