showId,category,title,tags,age_rating,rating_description,description,representation,duration_txt,duration_sec,first_broadcast,synopsis_small,synopsis_medium,synopsis_large,image
145,Entertainment,MasterChef - Series 13: Episode 25,"BBC, iPlayer, TV, MasterChef, Series 13: Episode 25",PG,language,One of the three amateur cooks lifts the trophy and becomes the 13th MasterChef champion.,3.0,58 mins,3490,12 May 2017,One of the three amateur cooks lifts the trophy and becomes the 13th MasterChef champion.,"After a formidable seven-week competition, one of the three amateur cooks lifts the trophy and becomes the 13th MasterChef champion.","After a formidable seven-week competition, the search for the country's best amateur cook reaches its climax. The finalists have to push themselves to the limit for one last time before judges John Torode and Gregg Wallace crown one of the three highly-talented amateur cooks the champion.In three hours, they must produce three exceptional courses, push the culinary boundaries and give the judges an awe-inspiring tasting like never before. It is a night packed with culinary highlights as one of the three amateur cooks lifts the trophy and becomes the 13th MasterChef champion.",https://ichef.bbci.co.uk/images/ic/1200x675/p09ybmzt.jpg
152,Entertainment,Celebrity MasterChef - Series 12: Episode 6,"BBC, iPlayer, TV, Celebrity MasterChef, Series 12: Episode 6",PG,language,2016 champion Alexis Conran is among those returning to help with the judging.,3.0,89 mins,5325,8:30pm 1 Sep 2017,2016 champion Alexis Conran is among those returning to help with the judging.,"Returning contestants, including 2016 champion Alexis Conran, return to help John and Gregg decide which two celebrities should go through to the semi-finals.","The heat continues with the four remaining celebrities fighting for a place in the semi-finals. The first challenge they face is a knowledge and skills test, where they have to face John Torode and Gregg Wallace one by one and demonstrate their ability to identify a tray of ingredients, three root vegetables and three birds before being asked to cook a duck breast with swiss chard and a caper butter sauce in just 12 minutes.The celebrities are then split into teams and are sent out on a mass-catering challenge, which sees them making lunch for over 120 members of staff and players at The Oval cricket ground, home to Surrey County Cricket Club. With an array of ingredients, including beef mince, chicken supreme and sea bream, and a range of fruit and vegetables, the two teams must devise, prepare and serve the lunch, catering for various tastes while creating meat-based, vegetarian and dessert dishes in volume.It is then back to the MasterChef headquarters as the battle for semi-final places reaches its climax. The celebrities must now cook a faultless two-course meal that will not only be judged by John and Gregg but also by reigning Celebrity MasterChef champion Alexis Conran (2016) and finalists Louise Minchin (2016) and Sam Nixon (2015). Only the best two contestants can earn a semi-final place and come one step closer to winning the title of Celebrity MasterChef 2017.",https://ichef.bbci.co.uk/images/ic/1200x675/p05d1px0.jpg
154,Entertainment,Celebrity Best Home Cook - Series 1: Episode 4,"BBC, iPlayer, TV, Celebrity Best Home Cook, Series 1: Episode 4",PG,language,The cooking competition continues with ultimate TV dinners and a divisive Rustle Up.,3.0,59 mins,3540,9pm 3 Feb 2021,The cooking competition continues with ultimate TV dinners and a divisive Rustle Up.,"Seven celebrities cook their ultimate TV dinner and rustle up a dish with frozen peas to impress judges Mary, Angela and Chris in a bid to avoid the dreaded Eliminator.","The hunt to find the first Celebrity Best Home Cook is heating up as the competition nears its halfway point. The celebrities will once again be donning their aprons and rolling up their sleeves to impress produce expert Chris Bavin, Michelin star chef Angela Hartnett and queen of home cooking Dame Mary Berry. All with the socially distanced support of Claudia Winkleman. The first challenge takes us away from the dining table and into the living room as Mary Berry challenges the cooks to make their ultimate burger and chips for a TV dinner. Some of the celebrities keep it classic, opting for a good quality beef burger, oozing with melted cheese, while the others are hoping a vegetarian option or a delicate fish burger will be enough for them to get a Judges' Favourite and a step closer to avoiding the dreaded Eliminator. Day two gets off to a frosty start, as Chris reveals frozen peas as the secret ingredient that the celebrities must make the star of the dish for his Rustle Up challenge. One cook is particularly dis�pea�sed with the ingredient, while the others are excited by an Asian-inspired larder. With everything from curry to scones, the judges have a difficult decision deciding who will go through to next week and who will be cooking again for safety in this week�s Eliminator challenge.   Taking both challenges into consideration, the three judges decide who will be cooking again in this week's Eliminator following one of Angela�s toughest recipes to date. Judged blind, the tiniest of details can be the difference between survival and going home. Making a dough, deep frying and technical piping push the cooks to their limits and result in a shocking blind tasting by the three expert judges.",https://ichef.bbci.co.uk/images/ic/1200x675/p096khym.jpg
155,Entertainment,Strictly - It Takes Two - Series 19: Episode 25,"BBC, iPlayer, TV, Strictly - It Takes Two, Series 19: Episode 25",U,no material likely to offend or harm,Rylan has more Strictly exclusives ahead of the weekend�s Halloween extravaganza. ,3.0,29 mins,1743,6:30pm 29 Oct 2021,Rylan has more Strictly exclusives ahead of the weekend�s Halloween extravaganza.,"Rylan is on hand with more Strictly exclusives ahead of the weekend�s Halloween extravaganza, and head judge Shirley Ballas stops by for a chat.",Rylan is on hand with more Strictly exclusives ahead of the weekend�s Halloween extravaganza. Head judge Shirley Ballas stops by for a chat.  And we�re joined by a star-studded Friday Panel to discuss the couples' next dances.,https://ichef.bbci.co.uk/images/ic/1200x675/p0b1j1mc.jpg
160,Entertainment,Top Gear - Series 24: Episode 7,"BBC, iPlayer, TV, Top Gear, Series 24: Episode 7",15,contains mild violence and language,Matt drives an eight-wheeled rescue vehicle. Jamiroquai frontman Jay Kay is in the studio.,1.0,60 mins,3576,8pm 23 Apr 2017,Matt drives an eight-wheeled rescue vehicle. Jamiroquai frontman Jay Kay is in the studio.,Matt LeBlanc drives an eight-wheeled rescue vehicle from Russia and Rory Reid turns the world's ugliest car into a luxury yacht. Jamiroquai frontman Jay Kay is the studio guest.,"Matt LeBlanc drives an eight-wheeled rescue vehicle from Russia, Rory Reid turns the world's ugliest car into a luxury yacht and Chris Harris reviews the new Porsche Cayman. Jamiroquai frontman Jay Kay is the studio guest.",https://ichef.bbci.co.uk/images/ic/1200x675/p05y9989.jpg
164,Entertainment,The Rap Game UK - Extras: How To Build An Online Audience,"BBC, iPlayer, TV, The Rap Game UK, Extras: How To Build An Online Audience",12,mild language,Online rap personalities share secrets of how they were able to grow their audience.,2.0,5 mins,271,28 Sep 2019,Online rap personalities share secrets of how they were able to grow their audience.,Online personalities in the rap industry share some of the secrets of how they were able to grow their audience.,No data found,https://ichef.bbci.co.uk/images/ic/1200x675/p07pjm5q.jpg
167,Comedy,Gavin & Stacey - Series 2: Episode 4,"BBC, iPlayer, TV, Gavin & Stacey, Series 2: Episode 4",15,"moderate sex references, drug misuse","Mick becomes a minor celebrity for the night, while Stacey and Gavin start house-hunting.",1.0,29 mins,1729,9pm 30 Mar 2008,"Mick becomes a minor celebrity for the night, while Stacey and Gavin start house-hunting.","Comedy series. Mick becomes a minor celebrity while Stacey and Gavin go house-hunting. Nessa visits Stacey, and tensions between the newlyweds come to a head at the bowling alley.","Mick becomes a minor celebrity for the night, while Stacey and Gavin start house-hunting. Nessa visits Stacey and shows the others a thing or two at the bowling alley, but tensions between the newlyweds come to a head at the end of the night, leaving the embarrassed friends to take solace in some corn on the cobs.",https://ichef.bbci.co.uk/images/ic/1200x675/p089sd75.jpg
171,Comedy,Still Open All Hours - Series 1: Episode 1,"BBC, iPlayer, TV, Still Open All Hours, Series 1: Episode 1",12,contains mild sex references and innuendo,Granville is forced into taking extra security precautions for the shops takings.,3.0,29 mins,1735,6:25pm 26 Dec 2014,Granville is forced into taking extra security precautions for the shop's takings.,"Sitcom. Granville is forced into taking extra security precautions for the shop's takings, which cause him no end of discomfort.","David Jason returns as Granville, who has inherited the famous corner shop from his beloved but miserly uncle Arkwright. Now running the business with his cheerful and good-looking son Leroy, Granville continues to serve the local community with a keen eye on a profit from some familiar and new faces. In this opening episode Granville is forced into taking extra security precautions for the shop's takings, which cause him no end of discomfort. Eric suffers a curious injury. Love is in the air for some as Mavis receives a special delivery and Granville begins to play matchmaker.",https://ichef.bbci.co.uk/images/ic/1200x675/p07k0d72.jpg
172,Comedy,The Fresh Prince of Bel-Air - Series 1: 25. Working It Out,"BBC, iPlayer, TV, The Fresh Prince of Bel-Air, Series 1: 25. Working It Out",12,contains mild sex references,"Hilary has to go on a date with Wills best friend, Jazz.",2.0,22 mins,1342,1 Jan 2021,"Hilary has to go on a date with Will's best friend, Jazz.","To keep her new job as personal assistant to movie star Marissa Redman, Hilary has to accept a date with Will's best friend Jazz.","To keep her new job as personal assistant to a movie star, Hilary has to accept a date with Will's best friend, Jazz. Guest starring Queen Latifah.",https://ichef.bbci.co.uk/images/ic/1200x675/p08z9zfn.jpg
175,Comedy,Little Britain - Series 1: Episode 6,"BBC, iPlayer, TV, Little Britain, Series 1: Episode 6",12,contains mild sex references and bad language,"There is good news for Dennis, and Marjorie Dawes bumps into Paul while out shopping.",1.0,28 mins,1674,21 Oct 2003,"There is good news for Dennis, and Marjorie Dawes bumps into Paul while out shopping.","Matt Lucas and David Walliams take a comic look at life in Britain. There is good news for Dennis, and Marjorie Dawes bumps into Paul while out shopping.",No data found,https://ichef.bbci.co.uk/images/ic/1200x675/p01g4xlc.jpg
177,Comedy,Not Going Out - Series 1: 2. Death,"BBC, iPlayer, TV, Not Going Out, Series 1: 2. Death",15,"moderate bad language, moderate innuendo","Tims grandmother dies, bringing him and Kate closer together, much to Lees concern.",1.0,29 mins,1719,9:30pm 13 Oct 2006,"Tim's grandmother dies, bringing him and Kate closer together, much to Lee's concern.","Sitcom. Tim's grandmother dies, bringing him and Kate closer together. Lee is encouraged to share his thoughts with a therapist, who is not impressed.","Sitcom. Tim's grandmother dies, bringing him and Kate closer together, much to Lee's concern. He's encouraged to share his thoughts with a therapist, who is not impressed with Lee's inability to have a proper conversation. To add to this there is inappropriate behaviour at the funeral, a furious elderly relative and Tim's new tipple of choice is becoming addictive.",https://ichef.bbci.co.uk/images/ic/1200x675/p0909kjq.jpg
179,Comedy,2 Point 4 Children - Two Years Before the Mast,"BBC, iPlayer, TV, 2 Point 4 Children, Two Years Before the Mast",PG,contains mild sex references and threat,"Bill, Ben, Rona and David end up as stowaways on a cruise ship.",1.0,39 mins,2365,8:20pm 26 Dec 1996,"Bill, Ben, Rona and David end up as stowaways on a cruise ship.","Bill, Ben, Rona and David end up as stowaways on a cruise ship. Jenny is stuck at home with Bette and Aunt Pearl, who set about making Christmas dinner.",No data found,https://ichef.bbci.co.uk/images/ic/1200x675/p0bnfkxz.jpg
182,Comedy,Mock the Week - Series 20: Episode 7,"BBC, iPlayer, TV, Mock the Week, Series 20: Episode 7",18,strong language,Dara O Briain and the team return for more of the topical comedy show.,3.0,31 mins,1860,10pm 4 Nov 2021,Dara O Briain and the team return for more of the topical comedy show.,"Dara O Briain and Hugh Dennis return for a run of more hilarious episodes with guests Maisie Adam, Alasdair Beckett-King, Ivo Graham, Rhys James and Ria Lina.","Dara O Briain and Hugh Dennis are back for a run of more hilarious episodes as they jab their syringe of satire into the arm of the week’s news, all with the support of guests Maisie Adam, Alasdair Beckett-King, Ivo Graham, Rhys James and Ria Lina.",https://ichef.bbci.co.uk/images/ic/1200x675/p0b28nch.jpg
185,Comedy,Bad Education - Series 3: 3. Sports Day,"BBC, iPlayer, TV, Bad Education, Series 3: 3. Sports Day",15,contains strong sex references,Its sports day and Fraser has hired the most inappropriate new teacher to oversee events.,3.0,29 mins,1713,10pm 30 Sep 2014,It's sports day and Fraser has hired the most inappropriate new teacher to oversee events.,School-based sitcom. It is Abbey Grove's sports day and Fraser has hired the most inappropriate new sports teacher to oversee events - Preet.,"It's Abbey Grove's sports day and Fraser has hired the most inappropriate new sports teacher to oversee events - Preet. Alfie sees this as the perfect opportunity to challenge Miss Gulliver's ex-boyfriend to an endurance event, which Preet offers to design. But with a steroid scandal rocking the school and Alfie desperate to win by any means possible, will he make it over the finish line with his dignity intact?",https://ichef.bbci.co.uk/images/ic/1200x675/p0276mnm.jpg
186,Comedy,Still Game - Series 7: 4. Small Change,"BBC, iPlayer, TV, Still Game, Series 7: 4. Small Change",12,"moderate bad language, sex references",Navid and Boabby settle a dispute over whose job is the cushiest.,3.0,29 mins,1749,28 Oct 2016,Navid and Boabby settle a dispute over whose job is the cushiest.,"Sitcom. After a year of marriage, Fergie gets relationship advice from Jack and Victor. Navid and Boabby settle a dispute over whose job is the cushiest.","Comedy in which lifelong friends cope with everything modern life has to throw at them. There are changes afoot in Craiglang. After one year of marriage, Fergie gets relationship advice from Jack and Victor, while Navid and Boabby settle a dispute over whose job is the cushiest.",https://ichef.bbci.co.uk/images/ic/1200x675/p04clh1f.jpg
188,Comedy,Keeping Up Appearances - Series 5: Episode 9,"BBC, iPlayer, TV, Keeping Up Appearances, Series 5: Episode 9",PG,contains very mild innuendo,"When Hyacinth decides that a new car is in order, she aims higher than most people.",1.0,30 mins,1800,8:30pm 29 Oct 1995,"When Hyacinth decides that a new car is in order, she aims higher than most people.","Sitcom. When Hyacinth decides that a new car is in order, she aims rather higher than most people - much to Richard's horror.",No data found,https://ichef.bbci.co.uk/images/ic/1200x675/p0b2b85p.jpg
190,Comedy,The Catherine Tate Show - Series 1: Episode 3,"BBC, iPlayer, TV, The Catherine Tate Show, Series 1: Episode 3",15,strong language,"Meet the Doncaster Spinners ageing majorette, the manipulative nan and an enigmatic cop.",3.0,29 mins,1735,10pm 1 Mar 2004,"Meet the Doncaster Spinners' ageing majorette, the manipulative nan and an enigmatic cop.","Meet the Doncaster Spinners' ageing majorette, the manipulative nan and the enigmatic cop.",No data found,https://ichef.bbci.co.uk/images/ic/1200x675/p02jppv1.jpg
192,Signed,MasterChef: The Professionals - Series 14: Episode 13 - Signed,"BBC, iPlayer, TV, MasterChef: The Professionals, Series 14: Episode 13",PG,language,Heat sevens Skills Test involves a prawn omelette and chicken kofte with cucumber salad.,3.0,29 mins,1725,7:30pm 29 Nov 2021,Heat seven's Skills Test involves a prawn omelette and chicken kofte with cucumber salad.,"Heat seven's Skills Test sees the four contenders preparing a prawn, avocado and pepper omelette and chicken kofte with flatbread and cucumber salad.","Four professional chefs arrive for heat seven, aiming to make their mark in the MasterChef kitchen and to stake their claim to the coveted title. First, they face the infamous Skills Test. Two of the four face Marcus Wareing's test: they have 20 minutes to prepare a prawn, avocado and pepper omelette served with prawn oil. The other two are challenged by Monica Galetti to make chicken kofte served with flatbread and cucumber salad.",https://ichef.bbci.co.uk/images/ic/1200x675/p0b6jm7d.jpg
193,Signed,Strictly Come Dancing - Series 19: Week 3 Results - Signed,"BBC, iPlayer, TV, Strictly Come Dancing, Series 19: Week 3 Results",U,infrequent mild bad language,Two couples face each other in the Movie Week dance-off. ,3.0,50 mins,3000,7:10pm 10 Oct 2021,Two couples face each other in the Movie Week dance-off.,"Two couples face each other in the Movie Week dance-off, and there's a special performance by star of stage and screen Ben Platt.","Movie Week continues with a routine by the Strictly professionals inspired by 2021 film In the Heights. There is also a very special music performance from star of stage and screen Ben Platt, singing You Will Be Found from the movie Dear Evan Hansen. Two couples face each other in our Movie Week dance-off. Who will the judges save, and who will leave the competition this weekend?",https://ichef.bbci.co.uk/images/ic/1200x675/p09y97c1.jpg
195,Signed,Waffle the Wonder Dog - Series 2: 1. Waffle's Ball Pit Pond - Signed,"BBC, iPlayer, TV, Waffle the Wonder Dog, Series 2: 1. Waffles Ball Pit Pond",U,no material likely to offen,Ali and Anaya come for a playdate and Mrs Hobbs tries to teach Waffle good behaviour.,3.0,11 mins,660,5:20pm 2 Jul 2018,Ali and Anaya come for a playdate and Mrs Hobbs tries to teach Waffle good behaviour.,"Preschool comedy drama series. Ali and Anaya come to play, but Waffle isn't joining in. He's next door with Mrs Hobbs, who is teaching him to be a good dog.","It's the hottest day of the year and Waffle is eating ice cream to cool down. Outside in the sweltering heat, Simon turns on the sprinkler to help everyone cool down, but poor Waffle doesn't like the sprinkler and darts through the hole in the fence to Mrs Hobbs's garden, looking for shade. The Brooklyn-Bells try to coax him back, but he refuses to return. Doug decides to make a mini swimming pool by filling the ball pit with cool water. Waffle loves swimming pools. Maybe that will encourage him back?",https://ichef.bbci.co.uk/images/ic/1200x675/p06cdj94.jpg
198,Signed,Louis Theroux - Behind Bars,"BBC, iPlayer, TV, Louis Theroux, Behind Bars",15,"strong language, discriminatory",Louis travels to California to spend two weeks in the notorious San Quentin State Prison.,1.0,59 mins,3540,9:10pm 13 Jan 2008,Louis travels to California to spend two weeks in the notorious San Quentin State Prison.,"Louis travels to California to spend two weeks in the notorious San Quentin State Prison. Built in 1852, San Quentin is dangerously overcrowded.","Another chance to see the BAFTA award winning presenter travelling to northern California to visit America's notorious San Quentin State Prison.Built in 1852, San Quentin is one of America's oldest prisons and suffers from chronic overcrowding. Although famous for its death row the prison's main task is to house a transient population of 3,000 murderers, sexual predators and small-time criminals.Louis spends two weeks with these inmates and quickly discovers that they inhabit a strange world within a world with its own rules and its own brutal code of conduct. He meets amongst others David Silva who is serving 521 years and 11 life sentences and is locked down for 23 hours a day. Silva's crimes as he describes them 'would never be forgotten' and he talks of how he faces up to the prospect of never leaving prison. Louis meets Deborah and Rob a transgender couple who live like husband and wife and how Deborah feels that after 20 years of continual offending, San Quentin now feels like home.",https://ichef.bbci.co.uk/images/ic/1200x675/p06k8t74.jpg
200,Signed,"Go Jetters - Series 3: 8. Middle of the World City, Ecuador","BBC, iPlayer, TV, Go Jetters, Series 3: 8. Middle of the World City, Ecuador",U,clean,Someone pretends to be the Go Jetters and glitches a monument in Ecuador. Who could it be?,3.0,11 mins,660,2 Sep 2019,Someone pretends to be the Go Jetters and glitches a monument in Ecuador. Who could it be?,Glitch is out to prove he’s just as good as the Go Jetters when he heads to Ecuador and moves the Monument to the Equator.,"After hearing about how the Monument to the Equator in Ciudad Mitad del Mundo is in the wrong location, Glitch and his Glitchbots pretend to be the Go Jetters and move the monument onto the equator. But when things start to go wrong, Glitch must learn that some glitches are fine the way they are.",https://ichef.bbci.co.uk/images/ic/1200x675/p07pvwc6.jpg
201,Signed,The Mating Game - Series 1: 4. Freshwater: Timing Is Everything - Signed,"BBC, iPlayer, TV, The Mating Game, Series 1: 4. Freshwater: Timing Is Everything",PG,"animal fighting, very mild threat, animal mating",The cycle of freshwater triggers spectacular mating rituals and fierce competition.,,58 mins,3476,8pm 24 Oct 2021,The cycle of freshwater triggers spectacular mating rituals and fierce competition.,"Freshwater is often the stage on which millions of animals gather to find a mate, and the cycle of freshwater is the trigger for spectacular mating rituals and fierce competition.","Freshwater covers only a tiny fraction of the earth’s surface, but it is a vital meeting place for many animals - the stage on which millions gather to find a mate. Yet with so little of it available, and often only briefly, the challenge for most individuals is how to overcome intense competition when your rivals are just as dependent on the precious freshwater for their success. Whether it is from melting ice, torrential rain or shrinking wetlands, the cycle of freshwater is the trigger for spectacular mating rituals and fierce combat.The start of the rains in South Africa triggers a violent battle between male giant African bullfrogs. Rare hooded grebes in Patagonia perform one of nature’s more comical dances to seduce their partner, and a male cichlid fish builds a home for his harem from old snail shells, but a sneaky dwarf has the last laugh there.The mating season for animals that live in freshwater is often determined by when is best for their new offspring - even if that moment is far from ideal for the parents. In the wetlands of Zambia, female lechwe antelope search for the strongest males while contending with drought, and in the Pantanal of Brazil at the end of the dry season, caimans congregate in huge numbers around the last remaining water to perform their spectacular displays.For all those dependent on the cycle of freshwater to breed, timing is everything.",https://ichef.bbci.co.uk/images/ic/1200x675/p09z41sr.jpg
205,Signed,Civilisations - Series 1: 9. The Vital Spark - Signed,"BBC, iPlayer, TV, Civilisations, Series 1: 9. The Vital Spark",15,"strong sex references, disturbing images",Simon Schama explores the fate of art in the machine- and profit-driven world.,3.0,59 mins,3539,1 Mar 2018,Simon Schama explores the fate of art in the machine- and profit-driven world.,"Documentary. Simon Schama explores the fate of art in the machine- and profit-driven world, looking at the rise of art as a tradeable commodity.","Simon Schama begins Civilisations with this premise: that it is in art - the play of the creative imagination - that humanity expresses its most essential self: the power to break the tyranny of the humdrum, the grind of everyday. Art makes life worth living and is the great window into human potential. And societies become civilised to the extent that they take culture as seriously as the prosecution of power or the accumulation of wealth. But in the century of total war and industrial slaughter, was (and is) that enough? The cause of humanity went up in the smoke of the Nazi crematoria. Horror and terror brushed beauty aside and stamped on its pretensions. In the modern world, art has become increasingly commodified. Simon's last programme explores the fate of art in the machine- and profit-driven world. It looks at the rise of art as a tradeable commodity and turns on one central question. Should art create a realm separate from the modern world, a place where we can escape and pull the ladder up after us? Or should it plunge headlong into the chaos and cacophony while transforming the way we see it and live in it?Using the works of both dead and contemporary artists of the 20th and 21st centuries, Simon seeks answers to these profound questions. His conclusion is imbued with hope: despite all the travails of the present, by engaging with the here-and-now, art still offers civilisation an insight into the incomprehensibility of the world and a way to transcend its horrors with the enduring creativity of the human spirit.",https://ichef.bbci.co.uk/images/ic/1200x675/p060mfcz.jpg
