showId,category,title,tags,age_rating,rating_description,description,representation,duration_txt,duration_sec,first_broadcast,synopsis_small,synopsis_medium,synopsis_large,image
74,Documentaries,A Perfect Planet - Series 1: 1. Volcano,"BBC, iPlayer, TV, A Perfect Planet, Series 1: 1. Volcano",U,clean,"A look at how without volcanoes, there would be no life on Earth.",,59 mins,3549,3 Jan 2021,"A look at how without volcanoes, there would be no life on Earth.","A look at how without volcanoes, there would be no life on Earth. Although destructive, magma from the planet’s molten core builds land, and mineral-rich ash from eruptions fertilises the surface.",No data found,https://ichef.bbci.co.uk/images/ic/1200x675/p09240nc.jpg
79,Documentaries,Big Cats - Series 1: Episode 1,"BBC, iPlayer, TV, Big Cats, Series 1: Episode 1",PG,scenes of animals hunting,"Meet the worlds ultimate cats, remarkable members of an incredible animal family.",,58 mins,3480,11 Jan 2018,"Meet the world's ultimate cats, remarkable members of an incredible animal family.","Documentary series uncovering the secret lives of cats. In Ruaha, Tanzania, lions form huge super prides in order to hunt giants.","In Ruaha, Tanzania, lions form huge super prides in order to hunt giants. Amongst cats lions are unusual, the only one to live in groups. In numbers they find the strength and audacity to hunt the most formidable prey.In Sri Lanka a tiny rusty-spotted cat explores his forest home - 200 times smaller than a lion, the rusty-spotted is the smallest of all cats, but just as curious.The Canada lynx lives further north than any cat, relying on snowshoe hares to survive the bitterly cold winters. Until now, lynx were creatures of mystery, but now technology provides an insightinto their secret lives.Predators they may be, but cats are also tender, intelligent and emotional. Honey is an African leopard and a mother. For a decade she's worn a radio collar that has allowed scientists to follow her life's every twist and turn. Now in the worst drought in decades, she's battling to raise a cub.In the Himalayas, perhaps the world's most lonesome cat is searching for a mate - a male snow leopard, who may get just one chance to mate in his whole life.Cats are naturally secretive, elusive and cryptic animals. Only now have the latest developments in filming technology, and a surge in cat research, enabled us to bring the cat superstars out of the shadows.",https://ichef.bbci.co.uk/images/ic/1200x675/p08jjf8p.jpg
82,Documentaries,Fraud Squad - Series 4: Episode 6,"BBC, iPlayer, TV, Fraud Squad, Series 4: Episode 6",12,"moderate bad language, sex references, threat, violence",A leading academic steals nearly £3 million of grants meant for environmental research.,3.0,44 mins,2618,10am 22 Feb 2022,A leading academic steals nearly £3 million of grants meant for environmental research.,"An academic steals millions meant for environmental research, a council fights back against fraudulent compensation claims, and a conman steals £10,000 meant for Covid-19 support.","A leading Cambridge academic steals nearly £3 million of government grants meant for environmental research, then smuggles bundles of cash out of the country inside empty chocolate boxes. A local council fights back against fraudulent compensation claims that could cripple its budget, and a fraudster abuses the Covid-19 support scheme to line their own pockets with £10,000, stolen from the public purse.",https://ichef.bbci.co.uk/images/ic/1200x675/p0bpmts3.jpg
85,Documentaries,The Mating Game - Series 1: 4. Freshwater: Timing Is Everything,"BBC, iPlayer, TV, The Mating Game, Series 1: 4. Freshwater: Timing Is Everything",PG,animals mating,The cycle of freshwater triggers spectacular mating rituals and fierce competition.,,58 mins,3476,8pm 24 Oct 2021,The cycle of freshwater triggers spectacular mating rituals and fierce competition.,"Freshwater is often the stage on which millions of animals gather to find a mate, and the cycle of freshwater is the trigger for spectacular mating rituals and fierce competition.","Freshwater covers only a tiny fraction of the earth’s surface, but it is a vital meeting place for many animals - the stage on which millions gather to find a mate. Yet with so little of it available, and often only briefly, the challenge for most individuals is how to overcome intense competition when your rivals are just as dependent on the precious freshwater for their success. Whether it is from melting ice, torrential rain or shrinking wetlands, the cycle of freshwater is the trigger for spectacular mating rituals and fierce combat.The start of the rains in South Africa triggers a violent battle between male giant African bullfrogs. Rare hooded grebes in Patagonia perform one of nature’s more comical dances to seduce their partner, and a male cichlid fish builds a home for his harem from old snail shells, but a sneaky dwarf has the last laugh there.The mating season for animals that live in freshwater is often determined by when is best for their new offspring - even if that moment is far from ideal for the parents. In the wetlands of Zambia, female lechwe antelope search for the strongest males while contending with drought, and in the Pantanal of Brazil at the end of the dry season, caimans congregate in huge numbers around the last remaining water to perform their spectacular displays.For all those dependent on the cycle of freshwater to breed, timing is everything.",https://ichef.bbci.co.uk/images/ic/1200x675/p09z41sr.jpg
91,From the Archives,Waterloo Road - Series 9: Episode 20,"BBC, iPlayer, TV, Waterloo Road, Series 9: Episode 20",12,"moderate language, violence, references to sex, suicide",Kaceys boxing career is jeopardised when a challenge by Gabriella goes horribly wrong.,3.0,57 mins,3413,8pm 12 Mar 2014,Kacey's boxing career is jeopardised when a challenge by Gabriella goes horribly wrong.,School-based drama. Kacey's boxing career is jeopardised when a challenge by Gabriella goes horribly wrong. Simon turns to Christine when he finds himself unable to cope.,Kacey's boxing career is jeopardised when a challenge by Gabriella goes horribly wrong.Simon turns to Christine when he finds himself unable to cope with the challenges of Acting Head.,https://ichef.bbci.co.uk/images/ic/1200x675/p01thb59.jpg
93,From the Archives,Doctor Who - Series 11: 8. The Witchfinders,"BBC, iPlayer, TV, Doctor Who, Series 11: 8. The Witchfinders",12,mild threat,The Doctor and friends encounter a witch trial and King James I in the 17th century.,3.0,47 mins,2791,6:30pm 25 Nov 2018,The Doctor and friends encounter a witch trial and King James I in the 17th century.,"In 17th-century Lancashire, the Doctor, Yaz, Ryan and Graham become embroiled in a witch trial and the arrival of King James I.","The Doctor, Ryan, Graham and Yaz arrive in 17th-century Lancashire and become embroiled in a witch trial, run by the local landowner. As fear stalks the land, the arrival of King James I only serves to intensify the witch hunt. But is there something even more dangerous at work? Can the Doctor and friends keep the people of Bilehurst Cragg safe from all the forces that are massing in the land?",https://ichef.bbci.co.uk/images/ic/1200x675/p06sby6v.jpg
94,From the Archives,Waterloo Road - Series 3: Episode 11,"BBC, iPlayer, TV, Waterloo Road, Series 3: Episode 11",12,"moderate language, violence, references to sex, suicide","In an attempt to stop Bolton from leaving school, Rachel takes the kids on a prison trip.",3.0,60 mins,3600,8pm 10 Jan 2008,"In an attempt to stop Bolton from leaving school, Rachel takes the kids on a prison trip.","Drama series set in a secondary school. In a last-ditch attempt to stop Bolton from leaving school, Rachel takes the kids on a prison trip.","Drama series set in a secondary school. In a last-ditch attempt to stop Bolton from leaving school, Rachel takes the kids on a prison trip. The teachers experience exam pressure for themselves. Tom hides his relationship with Davina from Chlo and Mika.",https://ichef.bbci.co.uk/images/ic/1200x675/p07lygz2.jpg
95,From the Archives,The Killing - Series 3: Episode 2,"BBC, iPlayer, TV, The Killing, Series 3: Episode 2",15,strong violence,The police try to track down the kidnapper of Robert Zeuthens daughter Emilie.,3.0,59 mins,3540,17 Nov 2012,The police try to track down the kidnapper of Robert Zeuthen's daughter Emilie.,"Danish crime drama series.  Following the kidnapping of Robert Zeuthen's daughter Emilie, Copenhagen Police put every effort into tracking down the perpetrator and finding her.","Following the kidnapping of Robert Zeuthen's daughter Emilie, Copenhagen Police put every effort into tracking down the perpetrator and finding the little girl. Meanwhile, the kidnapping has quickly become a hot potato in the election campaign and Prime Minister Kamper must deal with the fallout.In Danish with English subtitles.",https://ichef.bbci.co.uk/images/ic/1200x675/p09ds9w1.jpg
99,From the Archives,My Family - Series 6: 4. Living the Dream,"BBC, iPlayer, TV, My Family, Series 6: 4. Living the Dream",12,"mild sex references, innuendo","When is pyramid selling not pyramid selling? When Ben says so, apparently.",3.0,29 mins,1737,8:30pm 7 Apr 2006,"When is pyramid selling not pyramid selling? When Ben says so, apparently.","Domestic sitcom. When is pyramid selling not pyramid selling? When Ben says so, apparently.",No data found,https://ichef.bbci.co.uk/images/ic/1200x675/p087szl1.jpg
101,From the Archives,Our Girl - Series 2: Georgie & Elvis,"BBC, iPlayer, TV, Our Girl, Series 2: Georgie & Elvis",15,"strong language, violence, injury detail","Our first glimpse of army medic Georgie Lane, at work and in her explosive private life.",3.0,6 mins,334,31 Aug 2016,"Our first glimpse of army medic Georgie Lane, at work and in her explosive private life.","Our first glimpse of our girl Georgie Lane (Michelle Keegan), as a dynamic army medic in the field of battle, and in her explosive private life back home in the UK.","Our first glimpse of our girl Georgie Lane (Michelle Keegan), as a dynamic army medic in the field of battle, and also in her explosive private life back home in the UK.This is the story of her first meeting with maverick SAS captain Elvis Harte, charting their growing attraction for one another in a prequel to the forthcoming BBC One series. Has Georgie found the man of her dreams, or is she the kind of girl who'll never be able to settle down outside of her day job?",https://ichef.bbci.co.uk/images/ic/1200x675/p046dzpk.jpg
102,From the Archives,15 Storeys High - Series 2: 5. The Baby,"BBC, iPlayer, TV, 15 Storeys High, Series 2: 5. The Baby",15,"innapropriate humour, mild nudity",Vince is offered a promotion at work on the condition that he completes a simple task.,3.0,28 mins,1675,12:30am 12 Mar 2004,Vince is offered a promotion at work on the condition that he completes a simple task.,"Vince decides to apply for a job as swimming pool manager, but he has to prove he's capable of looking after a baby in an emergency. Errol becomes rather taken with smoking.",No data found,https://ichef.bbci.co.uk/images/ic/1200x675/p09tpc3g.jpg
104,From the Archives,Top Gear - Series 6: Episode 11,"BBC, iPlayer, TV, Top Gear, Series 6: Episode 11",15,"contains mild violence, language",Does a Lamborghini Murcielago roadster give the same kick as 12 angry bulls?,1.0,59 mins,3554,7 Aug 2005,Does a Lamborghini Murcielago roadster give the same kick as 12 angry bulls?,The team find out if driving a Lamborghini Murcielago roadster gives the same kick as 12 angry bulls.,The team find out if driving a Lamborghini Murcielago roadster gives the same kick as 12 angry bulls the world's greatest power sliders grace the track and a look at the Ford F150 SVT Lightning pick-up. Timothy Spall is this week's 'Star in a Reasonably Priced Car'.,https://ichef.bbci.co.uk/images/ic/1200x675/p09t5q2w.jpg
105,From the Archives,Heroes - Series 3: 8. Villains,"BBC, iPlayer, TV, Heroes, Series 3: 8. Villains",15,"strong bloody violence, horror",Hiro tries to discover what drove Arthur Petrelli to create Pinehearst.,3.0,41 mins,2448,12 Nov 2008,Hiro tries to discover what drove Arthur Petrelli to create Pinehearst.,Drama series about people with superpowers. Hiro tries to discover what drove Arthur Petrelli to create Pinehearst and strike at Angela before he died.,"Drama series in which people all over the world deal with their newly discovered superpowers. Hiro follows respected businessman, husband and father Arthur Petrelli in the days before he died, to discover what drove him to create Pinehearst and strike at Angela. Later, a moment unfolds where Sylar, horrified and guilt-ridden, might have stopped his murderous pursuit of abilities if H.R.G. and Elle had swayed from their monstrous assignment.",https://ichef.bbci.co.uk/images/ic/1200x675/p08l06f8.jpg
106,From the Archives,Louis Theroux - Selling Sex,"BBC, iPlayer, TV, Louis Theroux, Selling Sex",18,"strong sex references, child sexual abuse references",Louis Theroux meets the women legally providing sexual services to paying clients.,1.0,59 mins,3528,12 Jan 2020,Louis Theroux meets the women legally providing sexual services to paying clients.,"Louis Theroux meets the women legally participating in the new sexual economy, exploring whether selling sex can ever be a healthy way to make money.","The exchange of sex for money is legal in Britain, so long as it doesn’t involve coercion, exploitation, or any kind of public nuisance. Now, fuelled by websites and social media, a new economy has emerged – bringing a world of transactional sex to people who might never have previously considered it.  Bafta Award-winning film-maker Louis Theroux returns to the UK to meet women legally providing sexual services, either to make a living or to supplement their income, potentially earning hundreds of pounds per hour. But rather than on the streets or in illegal brothels, these women sell sex from their own homes or hotels, utilising technology to share photos, make bookings and vet potential clients - making the exchange more accessible and, according to some, safer than the illegal alternatives.  The age-old issue of whether sex should ever be traded remains, with many believing it to be exploitative and damaging, driven by a society still shaped by the desires of men. Yet there are those who feel that selling sex can be a valid, empowering choice for those who choose to engage in it. As Louis meets the women and men participating in the new sexual economy, he explores whether selling sex can ever be a healthy way to make money.",https://ichef.bbci.co.uk/images/ic/1200x675/p07znrwq.jpg
107,From the Archives,"Silent Witness - Series 9: 2. Ghosts, Part 2","BBC, iPlayer, TV, Silent Witness, Series 9: 2. Ghosts, Part 2",15,contains infrequent strong crime scene detail,Leo pursues the man responsible for the hit-and-run.,3.0,59 mins,3568,9pm 26 Jul 2005,Leo pursues the man responsible for the hit-and-run.,"As the police infiltrate a gang of identity thieves, Leo faces a choice between justice and revenge.","As the police infiltrate a gang of identity thieves, Leo faces a choice between justice and revenge.",https://ichef.bbci.co.uk/images/ic/1200x675/p07zv22k.jpg
112,From the Archives,One Foot in the Grave - Series 5: 5. Hole in the Sky,"BBC, iPlayer, TV, One Foot in the Grave, Series 5: 5. Hole in the Sky",12,satire,"Margaret comes into some money, and Victor helps a young Dutch girl get back on her feet.",1.0,29 mins,1728,9:05pm 22 Jan 1995,"Margaret comes into some money, and Victor helps a young Dutch girl get back on her feet.","Award-winning sitcom about a grumpy senior citizen. Margaret comes into some money, and Victor helps a young Dutch girl to get back on her feet.","Sitcom about a grumpy senior citizen. Margaret comes into some money, and Victor helps a young Dutch girl to get back on her feet. To add to the usual mayhem, the builders arrive to embark on a loft conversion.",https://ichef.bbci.co.uk/images/ic/1200x675/p09wnl6b.jpg
114,From the Archives,Merlin - Series 2: 5. Beauty and the Beast - Part 1,"BBC, iPlayer, TV, Merlin, Series 2: 5. Beauty and the Beast - Part 1",12,moderate violence,"Uther is captivated by the beautiful Lady Catrina, who Merlin suspects to be a troll.",1.0,43 mins,2576,6:15pm 24 Oct 2009,"Uther is captivated by the beautiful Lady Catrina, who Merlin suspects to be a troll.","Fantasy drama. Uther is captivated by the beautiful Lady Catrina. His flirting appals Arthur, and Merlin is wary - he suspects her to be a troll.","Uther is captivated by his latest guest, the beautiful Lady Catrina. Arthur is appalled by his father's flirting, but Merlin is wary for a different reason - he suspects she is really a troll! Catrina and her strange servant are welcomed into the heart of Camelot, and it is up to Merlin to prove she is a monster and save Uther from ruin. Unfortunately, Catrina has her sights set on a far greater prize than the king's heart - can Merlin overcome her powerful troll magic before it is too late?",https://ichef.bbci.co.uk/images/ic/1200x675/p07wx8x1.jpg
117,Sports,A View from the Terrace - Series 4: Episode 15,"BBC, iPlayer, TV, A View from the Terrace, Series 4: Episode 15",U,clean,New boy Sean Hamilton flashes back to the 2010/11 Scottish football season.,,58 mins,3480,10:30pm 11 Mar 2022,New boy Sean Hamilton flashes back to the 2010/11 Scottish football season.,"An irreverent look at the world of Scottish football, from the top of the pile to the dogfights. New boy Sean Hamilton flashes back to the 2010/11 Scottish football season.",No data found,https://ichef.bbci.co.uk/images/ic/1200x675/p0btvpwp.jpg
118,Sports,The Women's Football Show - 2021/22: 13/03/2022,"BBC, iPlayer, TV, The Womens Football Show, 2021/22: 13/03/2022",U,clean,Arsenal travel to Brighton & Hove Albion and Tottenham host Manchester City in the WSL.,,34 mins,2042,9:30pm 13 Mar 2022,Arsenal travel to Brighton & Hove Albion and Tottenham host Manchester City in the WSL.,Highlights from the FA Women's Super League as Arsenal travel to Brighton & Hove Albion and Tottenham Hotspur host Manchester City.,"Highlights from the FA Women's Super League as Arsenal travel to Brighton & Hove Albion and Tottenham Hotspur host Manchester City. The other fixtures are Reading v Manchester United, Everton v Leicester City, Chelsea v Aston Villa and Birmingham City v West Ham United.",https://ichef.bbci.co.uk/images/ic/1200x675/p0bvbn51.jpg
125,Sports,Irish Cup - 2021: Semi-Final: Larne v Crusaders,"BBC, iPlayer, TV, Irish Cup, 2021: Semi-Final: Larne v Crusaders",U,clean,Stephen Watson presents coverage of the Irish Cup semi-final between Larne and Crusaders.,,167 mins,10042,3:40pm 18 May 2021,Stephen Watson presents coverage of the Irish Cup semi-final between Larne and Crusaders.,"Stephen Watson presents coverage of the first Irish Cup semi-final between Larne and Crusaders from Mourneview Park, Lurgan.",No data found,https://ichef.bbci.co.uk/images/ic/1200x675/p09jfmjk.jpg
126,Sports,George Best: All by Himself,"BBC, iPlayer, TV, George Best: All by Himself",U,clean,How a reserved young prodigy from Northern Ireland became a global superstar.,,90 mins,5372,19 Jun 2017,How a reserved young prodigy from Northern Ireland became a global superstar.,"Documentary exploring the remarkable life of the footballer George Best, charting how a reserved young prodigy from Northern Ireland became a global superstar.",The story of the reserved young prodigy from Northern Ireland who became a global superstar.This is the feature-length documentary exploring the remarkable life of the footballer George Best.,https://ichef.bbci.co.uk/images/ic/1200x675/p08fj59w.jpg
127,Sports,The FA Cup - 2021/22: Quarter-Final: Southampton v Manchester City,"BBC, iPlayer, TV, The FA Cup, 2021/22: Quarter-Final: Southampton v Manchester City",U,clean,Live coverage of the FA Cup quarter-final clash between Southampton and Manchester City.,,149 mins,8940,2:35pm 20 Mar 2022,Live coverage of the FA Cup quarter-final clash between Southampton and Manchester City.,Live coverage of the FA Cup quarter-final clash between Southampton and Manchester City from St Mary's Stadium.,No data found,https://ichef.bbci.co.uk/images/ic/1200x675/p0bvmljk.jpg
129,Sports,Badminton - All England Open Championships 2022: Round of 32,"BBC, iPlayer, TV, Badminton, All England Open Championships 2022: Round of 32",U,clean,Coverage of the All England Open Badminton Championships round of 32.,,570 mins,34191,16 Mar 2022,Coverage of the All England Open Badminton Championships round of 32.,Coverage of the All England Open Badminton Championships round of 32.,No data found,https://ichef.bbci.co.uk/images/ic/1200x675/p0bvgjs2.jpg
134,Sports,Irish League Football - Friday Night Football 2021/2022: Linfield v Crusaders,"BBC, iPlayer, TV, Irish League Football, Friday Night Football 2021/2022: Linfield v Crusaders",U,clean,Stephen Watson presents live Irish Premiership coverage of Linfield v Crusaders.,,149 mins,8945,7:30pm 11 Mar 2022,Stephen Watson presents live Irish Premiership coverage of Linfield v Crusaders.,Stephen Watson presents live Irish Premiership coverage of Linfield v Crusaders.,"Stephen Watson presents live Irish Premiership coverage of Linfield v Crusaders.League leaders Linfield will be hoping to cement their place at the head of the table, while Stephen Baxter’s side will be looking to secure a top-six place before the split.David Jeffrey and Stephen Craigan provide match analysis, while Nicola McCarty keeps viewers up to date with reports and reaction from pitchside. Commentary is by Thomas Kane.",https://ichef.bbci.co.uk/images/ic/1200x675/p07ryf3n.jpg
136,Sports,Snooker: Welsh Open - 2022: 8. Day Four - Part 1,"BBC, iPlayer, TV, Snooker: Welsh Open, 2022: 8. Day Four - Part 1",U,clean,Ian Hunt introduces live action from the ICC Wales as the third round draws to a close.,,270 mins,16200,1pm 3 Mar 2022,Ian Hunt introduces live action from the ICC Wales as the third round draws to a close.,Ian Hunt introduces live action from the ICC Wales as the third round draws to a close.,No data found,https://ichef.bbci.co.uk/images/ic/1200x675/p0bsjnzq.jpg
138,Sports,NIFL Premiership Highlights - 2021/2022: 13/09/2021,"BBC, iPlayer, TV, NIFL Premiership Highlights, 2021/2022: 13/09/2021",U,clean,Nicola McCarthy presents highlights from the Irish Premiership.,,29 mins,1738,11:15pm 13 Sep 2021,Nicola McCarthy presents highlights from the Irish Premiership.,Nicola McCarthy presents highlights from the latest round of league matches in the Irish Premiership.,No data found,https://ichef.bbci.co.uk/images/ic/1200x675/p09x7b75.jpg
140,Sports,NIFL Premiership Highlights - 2021/2022: 28/12/2021,"BBC, iPlayer, TV, NIFL Premiership Highlights, 2021/2022: 28/12/2021",U,clean,Nicola McCarthy presents highlights from the Irish Premiership.,,29 mins,1740,27 Dec 2021,Nicola McCarthy presents highlights from the Irish Premiership.,Nicola McCarthy presents highlights from the Irish Premiership.,No data found,https://ichef.bbci.co.uk/images/ic/1200x675/p0bgc2lm.jpg
141,Entertainment,Top Gear - Series 4: Episode 8,"BBC, iPlayer, TV, Top Gear, Series 4: Episode 8",15,contains mild violence and language,"The trio test a Ford GT40, Maserati Quattroporte and Toyota Prius. With Martin Clunes.",1.0,59 mins,3534,8pm 18 Jul 2004,"The trio test a Ford GT40, Maserati Quattroporte and Toyota Prius. With Martin Clunes.","The trio look at the new Ford GT40, Maserati Quattroporte and Toyota Prius, and have a diesel versus petrol hot hatch race. Martin Clunes is this week�s guest star.","The trio look at the new Ford GT40, Maserati Quattroporte and Toyota Prius, and have a diesel versus petrol hot hatch race. Martin Clunes is this week�s guest star.",https://ichef.bbci.co.uk/images/ic/1200x675/p09t2d3c.jpg
142,Entertainment,Top Gear - Series 25: Episode 4,"BBC, iPlayer, TV, Top Gear, Series 25: Episode 4",15,contains mild violence and language,"Matt LeBlanc tests the worlds fastest accelerating car, with a little help from NASA.",1.0,61 mins,3631,8pm 18 Mar 2018,"Matt LeBlanc tests the world's fastest accelerating car, with a little help from NASA.","Matt LeBlanc tests the world's fastest accelerating car, with a little help from NASA. Chris Harris pens a heartfelt love letter to the Citroen 2CV.","Matt LeBlanc tests the world's fastest accelerating car, with a little help from NASA. Chris Harris pens a heartfelt love letter to the Citroen 2CV, while Rory Reid samples some exciting cars from South Korea. Dara O Briain and Ed Byrne are the studio guests.",https://ichef.bbci.co.uk/images/ic/1200x675/p0613fxk.jpg
144,Entertainment,Michael McIntyre's The Wheel - Series 2: Episode 7,"BBC, iPlayer, TV, Michael McIntyres The Wheel, Series 2: Episode 7",15,contains strong language,"Mel B, Josh Widdicombe and Osi Umenyiora try to help the contestants win a fortune.",3.0,59 mins,3565,7:40pm 4 Dec 2021,"Mel B, Josh Widdicombe and Osi Umenyiora try to help the contestants win a fortune.","Michael McIntyre hosts as Mel B, Josh Widdicombe, Osi Umenyiora, Kerry Godliman, Jordan North, Rosemary Shrager and Dr Hilary Jones try to help the contestants win a life-changing cash prize.","Bafta award-winning Michael McIntyre is back with his hit Saturday night game show packed with huge stars, big laughs, and a colossal spinning wheel! Three contestants hope to answer their way to a fortune, guided by seven celebrities, but can they help them to win life-changing cash? That all depends on the spin of The Wheel. Celebrities on The Wheel tonight: Mel B, Josh Widdicombe, Osi Umenyiora, Kerry Godliman, Jordan North, Rosemary Shrager and Dr Hilary Jones.",https://ichef.bbci.co.uk/images/ic/1200x675/p0b6jnsz.jpg
