showId,category,title,tags,age_rating,rating_description,description,representation,duration_txt,duration_sec,first_broadcast,synopsis_small,synopsis_medium,synopsis_large,image
226,Science & Nature,Frozen Planet - 2. Spring,"BBC, iPlayer, TV, Frozen Planet, 2. Spring",PG,animal hunting,"Spring arrives in the polar regions, and the sun appears after an absence of five months.",,58 mins,3463,2 Nov 2011,"Spring arrives in the polar regions, and the sun appears after an absence of five months.","Documentary series. It's spring in the polar regions and, after a five-month absence, the sun reappears. The greatest seasonal transformation on our planet is under way.","Spring arrives in the polar regions, and the sun appears after an absence of five months warmth and life return to these magical ice worlds - the greatest seasonal transformation on our planet is under way.Male adelie penguins arrive in Antarctica to build their nests - it takes a good property to attract the best mates and the males will stop at nothing to better their rivals. But these early birds face the fiercest storms on the planet.In the Arctic, a polar bear mother is hunting with her cubs. Inland, the frozen rivers start to break up and billions of tons of ice are swept downstream in the greatest of polar spectacles. This meltwater fertilizes the Arctic Ocean, feeding vast shoals of Arctic cod and narwhal. The influx of freshwater accelerates the breakup of the sea ice - an area of ice the size of Australia will soon vanish from the Arctic.On land, a woolly bear caterpillar emerges from the snow having spent the winter frozen solid. Caterpillars normally become moths within months of hatching, but life is so harsh here that the woolly bear takes 14 years to reach adulthood. Once mature, it has only days to find a mate before it dies. Alongside the caterpillars, white arctic wolves race to raise their adorable cubs before the cold returns.In Antarctica, vast numbers of seabirds arrive on South Georgia joining the giant albatross and king penguins that have been there all winter. Elephant seals fight furious battles over females on a beach that contains the greatest mass of animals on the planet.Finally, the female adelie penguins arrive, chased from the water by killer whales. Mating and chick rearing lie ahead of them.",https://ichef.bbci.co.uk/images/ic/1200x675/p01h6jw0.jpg
228,Science & Nature,The Green Planet - Series 1: 1. Tropical Worlds,"BBC, iPlayer, TV, The Green Planet, Series 1: 1. Tropical Worlds",U,clean,"The world of tropical forests, from fast-growing trees to flowers that mimic dead animals.",,59 mins,3525,9 Jan 2022,"The world of tropical forests, from fast-growing trees to flowers that mimic dead animals.",Tropical rainforests are plant battlegrounds. New filming techniques allow us to enter the world of plants to see it from their perspective and on their timescale.,"More kinds of plants are crammed together in the tropical rainforests than anywhere else on Earth. The result is astonishing beauty and intense competition - a plant battleground. New filming techniques allow us to enter the plants’ world and see it from their perspective and on their timescale. From fast-growing trees to flowers that mimic dead animals, this is a journey into a magical world that operates on a different timescale to our own.",https://ichef.bbci.co.uk/images/ic/1200x675/p0bd8hrz.jpg
229,Science & Nature,Great Barrier Reef - 3. Reef and Beyond,"BBC, iPlayer, TV, Great Barrier Reef, 3. Reef and Beyond",U,clean,A look at the creatures who travel for thousands of miles to visit the reefs warm waters.,,59 mins,3546,8:10pm 15 Jan 2012,A look at the creatures who travel for thousands of miles to visit the reef's warm waters.,Monty Halls explores Australia's natural wonder. The Great Barrier Reef is vitally linked to the rest of the planet and creatures travel thousands of miles to visit.,"The Great Barrier Reef is vitally linked to the rest of the planet in many ways. Creatures travel for thousands of miles to visit in spectacular numbers, including tiger sharks, great whales, sea birds and the largest green turtle gathering on earth. Alien creatures that are rarely seen, like nautilus, also rise out of the deep to visit the reef's warm waters. Weather systems travelling from across the Pacific also affect the whole reef, including mighty cyclones that bring destruction and chaos to the coral and the creatures that live on it. And it is weather patterns and climate change on a global scale that are likely to shape the future of the Great Barrier Reef and all its wildlife.",https://ichef.bbci.co.uk/images/ic/1200x675/p08zg4th.jpg
230,Science & Nature,The Green Planet - Series 1: 5. Human Worlds,"BBC, iPlayer, TV, The Green Planet, Series 1: 5. Human Worlds",U,clean,"Two out of five plants are threatened, but people are finding many new ways to help them.",3.0,58 mins,3450,6 Feb 2022,"Two out of five plants are threatened, but people are finding many new ways to help them.","Two out of five wild plants are threatened with extinction. Today people are finding remarkable ways to help them, and so make our world a little greener and a little wilder.","We rely on plants for almost everything, including the air we breathe and the food we eat. Two in five wild plants are threatened with extinction, but people are finding new ways to help them, from projects in Africa to reseed the landscape to the rebuilding of a tropical forest in Brazil, tree by tree.",https://ichef.bbci.co.uk/images/ic/1200x675/p0blrlcb.jpg
231,Science & Nature,Aquarela,"BBC, iPlayer, TV, Aquarela",12,distressing scene,A cinematic journey through the transformative beauty and raw power of water.,,82 mins,4939,25 Aug 2021,A cinematic journey through the transformative beauty and raw power of water.,A cinematic journey through the transformative beauty and raw power of water and a wake-up call for humankind that we are no match for the force and will of earth’s most precious element.,"A cinematic journey through the transformative beauty and raw power of water that provides a visceral wake-up call for humankind that we are no match for the sheer force and capricious will of earth’s most precious element. From the precarious frozen waters of Russia’s Lake Baikal to Miami in the throes of Hurricane Irma to Venezuela’s mighty Angel Falls, water’s many personalities are captured in startling cinematic clarity.",https://ichef.bbci.co.uk/images/ic/1200x675/p09ss26y.jpg
232,Science & Nature,Zoo Quest - Zoo Quest for a Dragon: 5. Bali - Part Two,"BBC, iPlayer, TV, Zoo Quest, Zoo Quest for a Dragon: 5. Bali - Part Two",PG,infrequent mild bad language,David Attenborough encounters scaly anteaters as his expedition continues in Bali. (1956),3.0,30 mins,1789,8:15pm 2 Nov 1956,David Attenborough encounters scaly anteaters as his expedition continues in Bali. (1956),"First transmitted in 1956, the Zoo Quest team wander off the beaten track on the beautiful island of Bali, encountering curious villagers and remarkable creatures.","First transmitted in 1956, David Attenborough walks through avenues of palm trees and rice fields in order to reach a small Balinese village.Once there, he encounters curious villagers and remarkable creatures, including ants that demonstrate some ingenious behaviour.In addition to exploring less celebrated wildlife, this is also an opportunity to witness the unique Balinese culture with its hypnotic music and dance based on ancient Hindu legends.",https://ichef.bbci.co.uk/images/ic/1200x675/p01hz7pg.jpg
233,Science & Nature,Planet Earth II - 3. Jungles,"BBC, iPlayer, TV, Planet Earth II, 3. Jungles",U,animal hunting,A look at the animals competing to survive in the rich habitats of the planets jungles.,,58 mins,3479,20 Nov 2016,A look at the animals competing to survive in the rich habitats of the planet's jungles.,Jungles provide the richest habitats on the planet - mysterious worlds of high drama where extraordinary animals attempt to survive in the most competitive place on earth.,"Jungles provide the richest habitats on the planet - mysterious worlds of high drama where extraordinary animals attempt to survive in the most competitive place on earth. Flooded forests are home to caiman-hunting jaguars and strange dolphins that swim amongst the tree tops, while in the dense underworld, ninja frogs fight off wasps and flying dragons soar between trees. Acrobatic indri leap through the forests of Madagascar, while the jungle night conceals strange fungi and glow-in-the-dark creatures never filmed before.",https://ichef.bbci.co.uk/images/ic/1200x675/p04gblmy.jpg
237,Science & Nature,Shark - Episode 3,"BBC, iPlayer, TV, Shark, Episode 3",15,scenes of animal threat,An international team of scientists is trying to change perceptions of sharks.,,58 mins,3480,9pm 21 May 2015,An international team of scientists is trying to change perceptions of sharks.,"Wildlife series on the sharks of the world. Sharks are among the most misunderstood predators on the planet, but a team of scientists is trying to change that.","Sharks are among the most misunderstood predators on the planet, but an international team of scientists is trying to change that. Their research is revealing that sharks can be sociable and intelligent, and they could even help solve some of the toughest medical challenges of the 21st century. However, their breakthroughs come just as many sharks face extinction. Science may now be the only way to save them.",https://ichef.bbci.co.uk/images/ic/1200x675/p02r49lt.jpg
