showId,category,title,tags,age_rating,rating_description,description,representation,duration_txt,duration_sec,first_broadcast,synopsis_small,synopsis_medium,synopsis_large,image
145,Entertainment,MasterChef - Series 13: Episode 25,"BBC, iPlayer, TV, MasterChef, Series 13: Episode 25",PG,language,One of the three amateur cooks lifts the trophy and becomes the 13th MasterChef champion.,3.0,58 mins,3490,12 May 2017,One of the three amateur cooks lifts the trophy and becomes the 13th MasterChef champion.,"After a formidable seven-week competition, one of the three amateur cooks lifts the trophy and becomes the 13th MasterChef champion.","After a formidable seven-week competition, the search for the country's best amateur cook reaches its climax. The finalists have to push themselves to the limit for one last time before judges John Torode and Gregg Wallace crown one of the three highly-talented amateur cooks the champion.In three hours, they must produce three exceptional courses, push the culinary boundaries and give the judges an awe-inspiring tasting like never before. It is a night packed with culinary highlights as one of the three amateur cooks lifts the trophy and becomes the 13th MasterChef champion.",https://ichef.bbci.co.uk/images/ic/1200x675/p09ybmzt.jpg
146,Entertainment,Celebrity MasterChef - Series 15: Episode 3,"BBC, iPlayer, TV, Celebrity MasterChef, Series 15: Episode 3",PG,language,The remaining four celebrities compete for the first two semi-final places.,3.0,29 mins,1735,8:30pm 3 Jul 2020,The remaining four celebrities compete for the first two semi-final places.,"The competition for the first two semi-final places reaches its climax as the celebrities cook for three of the previous year's contestants, including champion Greg Rutherford.","The battle for the first two semi-final places in this year�s competition reaches its climax, as the four remaining celebrities must cook a faultless two-course meal that will not only be judged by John and Gregg, but also by three Celebrity MasterChef legends: last year�s champion, Olympic long jumper Greg Rutherford, and TV personalities Vicky Pattison and Dom Parker.  Only the best two cooks can come one step closer to winning the title of Celebrity MasterChef 2020. For those who don�t cut the mustard, the journey ends here.",https://ichef.bbci.co.uk/images/ic/1200x675/p08jp7lq.jpg
152,Entertainment,Celebrity MasterChef - Series 12: Episode 6,"BBC, iPlayer, TV, Celebrity MasterChef, Series 12: Episode 6",PG,language,2016 champion Alexis Conran is among those returning to help with the judging.,3.0,89 mins,5325,8:30pm 1 Sep 2017,2016 champion Alexis Conran is among those returning to help with the judging.,"Returning contestants, including 2016 champion Alexis Conran, return to help John and Gregg decide which two celebrities should go through to the semi-finals.","The heat continues with the four remaining celebrities fighting for a place in the semi-finals. The first challenge they face is a knowledge and skills test, where they have to face John Torode and Gregg Wallace one by one and demonstrate their ability to identify a tray of ingredients, three root vegetables and three birds before being asked to cook a duck breast with swiss chard and a caper butter sauce in just 12 minutes.The celebrities are then split into teams and are sent out on a mass-catering challenge, which sees them making lunch for over 120 members of staff and players at The Oval cricket ground, home to Surrey County Cricket Club. With an array of ingredients, including beef mince, chicken supreme and sea bream, and a range of fruit and vegetables, the two teams must devise, prepare and serve the lunch, catering for various tastes while creating meat-based, vegetarian and dessert dishes in volume.It is then back to the MasterChef headquarters as the battle for semi-final places reaches its climax. The celebrities must now cook a faultless two-course meal that will not only be judged by John and Gregg but also by reigning Celebrity MasterChef champion Alexis Conran (2016) and finalists Louise Minchin (2016) and Sam Nixon (2015). Only the best two contestants can earn a semi-final place and come one step closer to winning the title of Celebrity MasterChef 2017.",https://ichef.bbci.co.uk/images/ic/1200x675/p05d1px0.jpg
154,Entertainment,Celebrity Best Home Cook - Series 1: Episode 4,"BBC, iPlayer, TV, Celebrity Best Home Cook, Series 1: Episode 4",PG,language,The cooking competition continues with ultimate TV dinners and a divisive Rustle Up.,3.0,59 mins,3540,9pm 3 Feb 2021,The cooking competition continues with ultimate TV dinners and a divisive Rustle Up.,"Seven celebrities cook their ultimate TV dinner and rustle up a dish with frozen peas to impress judges Mary, Angela and Chris in a bid to avoid the dreaded Eliminator.","The hunt to find the first Celebrity Best Home Cook is heating up as the competition nears its halfway point. The celebrities will once again be donning their aprons and rolling up their sleeves to impress produce expert Chris Bavin, Michelin star chef Angela Hartnett and queen of home cooking Dame Mary Berry. All with the socially distanced support of Claudia Winkleman. The first challenge takes us away from the dining table and into the living room as Mary Berry challenges the cooks to make their ultimate burger and chips for a TV dinner. Some of the celebrities keep it classic, opting for a good quality beef burger, oozing with melted cheese, while the others are hoping a vegetarian option or a delicate fish burger will be enough for them to get a Judges' Favourite and a step closer to avoiding the dreaded Eliminator. Day two gets off to a frosty start, as Chris reveals frozen peas as the secret ingredient that the celebrities must make the star of the dish for his Rustle Up challenge. One cook is particularly dis�pea�sed with the ingredient, while the others are excited by an Asian-inspired larder. With everything from curry to scones, the judges have a difficult decision deciding who will go through to next week and who will be cooking again for safety in this week�s Eliminator challenge.   Taking both challenges into consideration, the three judges decide who will be cooking again in this week's Eliminator following one of Angela�s toughest recipes to date. Judged blind, the tiniest of details can be the difference between survival and going home. Making a dough, deep frying and technical piping push the cooks to their limits and result in a shocking blind tasting by the three expert judges.",https://ichef.bbci.co.uk/images/ic/1200x675/p096khym.jpg
155,Entertainment,Strictly - It Takes Two - Series 19: Episode 25,"BBC, iPlayer, TV, Strictly - It Takes Two, Series 19: Episode 25",U,no material likely to offend or harm,Rylan has more Strictly exclusives ahead of the weekend�s Halloween extravaganza. ,3.0,29 mins,1743,6:30pm 29 Oct 2021,Rylan has more Strictly exclusives ahead of the weekend�s Halloween extravaganza.,"Rylan is on hand with more Strictly exclusives ahead of the weekend�s Halloween extravaganza, and head judge Shirley Ballas stops by for a chat.",Rylan is on hand with more Strictly exclusives ahead of the weekend�s Halloween extravaganza. Head judge Shirley Ballas stops by for a chat.  And we�re joined by a star-studded Friday Panel to discuss the couples' next dances.,https://ichef.bbci.co.uk/images/ic/1200x675/p0b1j1mc.jpg
160,Entertainment,Top Gear - Series 24: Episode 7,"BBC, iPlayer, TV, Top Gear, Series 24: Episode 7",15,contains mild violence and language,Matt drives an eight-wheeled rescue vehicle. Jamiroquai frontman Jay Kay is in the studio.,1.0,60 mins,3576,8pm 23 Apr 2017,Matt drives an eight-wheeled rescue vehicle. Jamiroquai frontman Jay Kay is in the studio.,Matt LeBlanc drives an eight-wheeled rescue vehicle from Russia and Rory Reid turns the world's ugliest car into a luxury yacht. Jamiroquai frontman Jay Kay is the studio guest.,"Matt LeBlanc drives an eight-wheeled rescue vehicle from Russia, Rory Reid turns the world's ugliest car into a luxury yacht and Chris Harris reviews the new Porsche Cayman. Jamiroquai frontman Jay Kay is the studio guest.",https://ichef.bbci.co.uk/images/ic/1200x675/p05y9989.jpg
164,Entertainment,The Rap Game UK - Extras: How To Build An Online Audience,"BBC, iPlayer, TV, The Rap Game UK, Extras: How To Build An Online Audience",12,mild language,Online rap personalities share secrets of how they were able to grow their audience.,2.0,5 mins,271,28 Sep 2019,Online rap personalities share secrets of how they were able to grow their audience.,Online personalities in the rap industry share some of the secrets of how they were able to grow their audience.,No data found,https://ichef.bbci.co.uk/images/ic/1200x675/p07pjm5q.jpg
167,Comedy,Gavin & Stacey - Series 2: Episode 4,"BBC, iPlayer, TV, Gavin & Stacey, Series 2: Episode 4",15,"moderate sex references, drug misuse","Mick becomes a minor celebrity for the night, while Stacey and Gavin start house-hunting.",1.0,29 mins,1729,9pm 30 Mar 2008,"Mick becomes a minor celebrity for the night, while Stacey and Gavin start house-hunting.","Comedy series. Mick becomes a minor celebrity while Stacey and Gavin go house-hunting. Nessa visits Stacey, and tensions between the newlyweds come to a head at the bowling alley.","Mick becomes a minor celebrity for the night, while Stacey and Gavin start house-hunting. Nessa visits Stacey and shows the others a thing or two at the bowling alley, but tensions between the newlyweds come to a head at the end of the night, leaving the embarrassed friends to take solace in some corn on the cobs.",https://ichef.bbci.co.uk/images/ic/1200x675/p089sd75.jpg
172,Comedy,The Fresh Prince of Bel-Air - Series 1: 25. Working It Out,"BBC, iPlayer, TV, The Fresh Prince of Bel-Air, Series 1: 25. Working It Out",12,contains mild sex references,"Hilary has to go on a date with Wills best friend, Jazz.",2.0,22 mins,1342,1 Jan 2021,"Hilary has to go on a date with Will's best friend, Jazz.","To keep her new job as personal assistant to movie star Marissa Redman, Hilary has to accept a date with Will's best friend Jazz.","To keep her new job as personal assistant to a movie star, Hilary has to accept a date with Will's best friend, Jazz. Guest starring Queen Latifah.",https://ichef.bbci.co.uk/images/ic/1200x675/p08z9zfn.jpg
173,Comedy,Not Going Out - Series 8: 6. Marriage Guidance,"BBC, iPlayer, TV, Not Going Out, Series 8: 6. Marriage Guidance",15,"moderate bad language, moderate innuendo",How will Lee and Lucys marriage fare after marriage counselling?,1.0,28 mins,1676,9pm 24 Feb 2017,How will Lee and Lucy's marriage fare after marriage counselling?,Sitcom. How will Lee and Lucy's marriage fare after marriage counselling?,"If Lee and Lucy's marriage wasn't in trouble before they go to marriage counselling, it is by the time they leave.",https://ichef.bbci.co.uk/images/ic/1200x675/p04stc33.jpg
174,Comedy,Famalam - Series 3: Episode 5,"BBC, iPlayer, TV, Famalam, Series 3: Episode 5",15,"strong language, sex references, comic violence and gore",Fat Sam goes in search of romance.,2.0,22 mins,1326,23 Aug 2020,Fat Sam goes in search of romance.,"Fat Sam goes in search of romance, Shawn gets married, and movie star Babatunde Warrington shoots a music video.","Fat Sam goes in search of romance, while Shawn and Leslie get married. Movie star Babatunde Warrington shoots a music video, and our favourite African aunties return for more fun.",https://ichef.bbci.co.uk/images/ic/1200x675/p08p2853.jpg
175,Comedy,Little Britain - Series 1: Episode 6,"BBC, iPlayer, TV, Little Britain, Series 1: Episode 6",12,contains mild sex references and bad language,"There is good news for Dennis, and Marjorie Dawes bumps into Paul while out shopping.",1.0,28 mins,1674,21 Oct 2003,"There is good news for Dennis, and Marjorie Dawes bumps into Paul while out shopping.","Matt Lucas and David Walliams take a comic look at life in Britain. There is good news for Dennis, and Marjorie Dawes bumps into Paul while out shopping.",No data found,https://ichef.bbci.co.uk/images/ic/1200x675/p01g4xlc.jpg
177,Comedy,Not Going Out - Series 1: 2. Death,"BBC, iPlayer, TV, Not Going Out, Series 1: 2. Death",15,"moderate bad language, moderate innuendo","Tims grandmother dies, bringing him and Kate closer together, much to Lees concern.",1.0,29 mins,1719,9:30pm 13 Oct 2006,"Tim's grandmother dies, bringing him and Kate closer together, much to Lee's concern.","Sitcom. Tim's grandmother dies, bringing him and Kate closer together. Lee is encouraged to share his thoughts with a therapist, who is not impressed.","Sitcom. Tim's grandmother dies, bringing him and Kate closer together, much to Lee's concern. He's encouraged to share his thoughts with a therapist, who is not impressed with Lee's inability to have a proper conversation. To add to this there is inappropriate behaviour at the funeral, a furious elderly relative and Tim's new tipple of choice is becoming addictive.",https://ichef.bbci.co.uk/images/ic/1200x675/p0909kjq.jpg
179,Comedy,2 Point 4 Children - Two Years Before the Mast,"BBC, iPlayer, TV, 2 Point 4 Children, Two Years Before the Mast",PG,contains mild sex references and threat,"Bill, Ben, Rona and David end up as stowaways on a cruise ship.",1.0,39 mins,2365,8:20pm 26 Dec 1996,"Bill, Ben, Rona and David end up as stowaways on a cruise ship.","Bill, Ben, Rona and David end up as stowaways on a cruise ship. Jenny is stuck at home with Bette and Aunt Pearl, who set about making Christmas dinner.",No data found,https://ichef.bbci.co.uk/images/ic/1200x675/p0bnfkxz.jpg
182,Comedy,Mock the Week - Series 20: Episode 7,"BBC, iPlayer, TV, Mock the Week, Series 20: Episode 7",18,strong language,Dara O Briain and the team return for more of the topical comedy show.,3.0,31 mins,1860,10pm 4 Nov 2021,Dara O Briain and the team return for more of the topical comedy show.,"Dara O Briain and Hugh Dennis return for a run of more hilarious episodes with guests Maisie Adam, Alasdair Beckett-King, Ivo Graham, Rhys James and Ria Lina.","Dara O Briain and Hugh Dennis are back for a run of more hilarious episodes as they jab their syringe of satire into the arm of the week’s news, all with the support of guests Maisie Adam, Alasdair Beckett-King, Ivo Graham, Rhys James and Ria Lina.",https://ichef.bbci.co.uk/images/ic/1200x675/p0b28nch.jpg
186,Comedy,Still Game - Series 7: 4. Small Change,"BBC, iPlayer, TV, Still Game, Series 7: 4. Small Change",12,"moderate bad language, sex references",Navid and Boabby settle a dispute over whose job is the cushiest.,3.0,29 mins,1749,28 Oct 2016,Navid and Boabby settle a dispute over whose job is the cushiest.,"Sitcom. After a year of marriage, Fergie gets relationship advice from Jack and Victor. Navid and Boabby settle a dispute over whose job is the cushiest.","Comedy in which lifelong friends cope with everything modern life has to throw at them. There are changes afoot in Craiglang. After one year of marriage, Fergie gets relationship advice from Jack and Victor, while Navid and Boabby settle a dispute over whose job is the cushiest.",https://ichef.bbci.co.uk/images/ic/1200x675/p04clh1f.jpg
188,Comedy,Keeping Up Appearances - Series 5: Episode 9,"BBC, iPlayer, TV, Keeping Up Appearances, Series 5: Episode 9",PG,contains very mild innuendo,"When Hyacinth decides that a new car is in order, she aims higher than most people.",1.0,30 mins,1800,8:30pm 29 Oct 1995,"When Hyacinth decides that a new car is in order, she aims higher than most people.","Sitcom. When Hyacinth decides that a new car is in order, she aims rather higher than most people - much to Richard's horror.",No data found,https://ichef.bbci.co.uk/images/ic/1200x675/p0b2b85p.jpg
190,Comedy,The Catherine Tate Show - Series 1: Episode 3,"BBC, iPlayer, TV, The Catherine Tate Show, Series 1: Episode 3",15,strong language,"Meet the Doncaster Spinners ageing majorette, the manipulative nan and an enigmatic cop.",3.0,29 mins,1735,10pm 1 Mar 2004,"Meet the Doncaster Spinners' ageing majorette, the manipulative nan and an enigmatic cop.","Meet the Doncaster Spinners' ageing majorette, the manipulative nan and the enigmatic cop.",No data found,https://ichef.bbci.co.uk/images/ic/1200x675/p02jppv1.jpg
194,Signed,Odd Squad - Series 2: 16. The Creature Whisperer,"BBC, iPlayer, TV, Odd Squad, Series 2: 16. The Creature Whisperer",U,"threat, violence",The agents struggle to catch an odd creature.,3.0,11 mins,684,8am 5 Feb 2018,The agents struggle to catch an odd creature.,The Odd Squad investigates strange events. The agents struggle to catch an odd creature.,No data found,https://ichef.bbci.co.uk/images/ic/1200x675/p05wwtv5.jpg
199,Signed,School of Roars - Series 1: 23. Monster Choir,"BBC, iPlayer, TV, School of Roars, Series 1: 23. Monster Choir",U,clean,"When he joins the school choir, Yummble discovers hes too tuneful to sing monster songs.",,7 mins,420,4:15pm 17 May 2017,"When he joins the school choir, Yummble discovers he's too tuneful to sing monster songs.",Preschool animation. Yummble is very excited about performing with the school choir until he discovers he's too tuneful to sing monster songs.,Yummble is very excited about performing with the school choir until he discovers he's too tuneful to sing monster songs. Can Wufflebump help Yummble find a new rhythm in time for his debut at the school concert?,https://ichef.bbci.co.uk/images/ic/1200x675/p052jflk.jpg
208,Signed,Hey Duggee - Top of the Pups: The A Cappella Song,"BBC, iPlayer, TV, Hey Duggee, Top of the Pups: The A Cappella Song",U,clean,The Singing Squirrels are joined by none other than Hot Cheap for an impromptu sing off!,,1 min,73,20 Sep 2021,The Singing Squirrels are joined by none other than Hot Cheap for an impromptu sing off!,The Singing Squirrels are joined by none other than Hot Cheap for an impromptu sing off!,No data found,https://ichef.bbci.co.uk/images/ic/1200x675/p08hb7fy.jpg
209,Signed,Andy's Dinosaur Adventures - 2. Diplodocus and Fern - Signed,"BBC, iPlayer, TV, Andys Dinosaur Adventures, 2. Diplodocus and Fern",U,mild threat,"Andy travels back in time 152 million years, to the time of diplodocus.",1.0,14 mins,834,18 Feb 2014,"Andy travels back in time 152 million years, to the time of diplodocus.","Children's dinosaur history series. Andy travels back in time 152 million years, to the time of diplodocus.","Andy travels back in time 152 million years, to the time of diplodocus - a massive 25-metre-long plant-eating dinosaur. His mission is to find and pick a giant fern to replace the one he accidentally broke back at the museum. Along the way he witnesses an adult diplodocus knocking down trees with its front legs. Will he succeed before the museum opens?",https://ichef.bbci.co.uk/images/ic/1200x675/p07hxrd2.jpg
211,Signed,Topsy and Tim - Series 1: 23. Wrapping Paper - Signed,"BBC, iPlayer, TV, Topsy and Tim, Series 1: 23. Wrapping Paper",U,clean,The supermarket delivery brings Vindas birthday card and present but no wrapping paper.,1.0,11 mins,664,5:30pm 5 Mar 2014,The supermarket delivery brings Vinda's birthday card and present but no wrapping paper.,Live-action children's show. The supermarket delivery brings Vinda's birthday card and present but no wrapping paper.,"When the supermarket delivery brings Vinda's birthday card and present but no wrapping paper, Topsy and Tim decide to make their own paper for wrapping Vinda's gift.",https://ichef.bbci.co.uk/images/ic/1200x675/p01szwkw.jpg
219,Science & Nature,Planet Earth II - 4. Deserts,"BBC, iPlayer, TV, Planet Earth II, 4. Deserts",U,animal hunting,The incredible ways in which animals cope with living in the planets deserts.,,58 mins,3485,27 Nov 2016,The incredible ways in which animals cope with living in the planet's deserts.,"The world's deserts force animals to come up with ingenious ways of coping with hostile conditions, giving rise to the most incredible survival stories on earth.","The world's deserts are lands of extremes that force animals to come up with ingenious ways of coping with hostile conditions, giving rise to the most incredible survival stories on earth. A pride of desert lions are so hungry they risk hunting a giraffe several times their size, while male sandgrouse fly 120 miles each day to the nearest waterhole and dice with death to collect water for their chicks. Filmed for the first time, a tiny bat does battle with one of the world's deadliest scorpions, and in Madagascar, a locust swarm of biblical proportions is seen as never before.",https://ichef.bbci.co.uk/images/ic/1200x675/p04hbfgn.jpg
220,Science & Nature,Planet Earth - 2. Mountains,"BBC, iPlayer, TV, Planet Earth, 2. Mountains",U,animal hunting,"A look at mountains, from their origins at earths lowest places to the summit of Everest.",,58 mins,3452,12 Mar 2006,"A look at mountains, from their origins at earth's lowest places to the summit of Everest.","Documentary series which celebrates earth in all its glory. This edition looks at mountains, beginning with the birth of a mountain and ending at the summit of Everest.","Humans like to think that once they have climbed a mountain, they have somehow conquered it. But they can only ever be visitors to this alien, frozen world. Planet Earth takes you on a tour of its mightiest ranges, beginning with the birth of a mountain at one of the lowest places on earth, and ending at the summit of Everest. Unprecedented access brings you closer than ever before to the most awe-inspiring mountain landscapes on our planet and the secretive, almost mythical creatures that inhabit them - the 'real' mountaineers. In Ethiopia, Planet Earth ventures into the heart of a volcano to discover one of earth's rarest phenomena - a lava lake that has been erupting for over 100 years. The same forces created Ethiopia's Simien Mountains, home to troops of gelada baboons nearly a thousand strong. In the Andes, a family of five puma struggle to survive the most unstable mountain weather on the planet. Experience the full force of an avalanche in the Rockies, where grizzlies survive the harsh winters deep inside the dangerous slopes. In summer, the bears climb the peaks in search of moths, which they devour by the thousand.Descend into the icy core of a glacier in the Alps and emerge in Pakistan, at the snout of the largest glacier on earth. This realm of giant peaks is home to the highest land predator on the planet - the snow leopard. Astounding images of a female snow leopard hunting to feed her cub are a world first.Enter a mountain cave in China for the first ever glimpse of a wild giant panda mother nursing her week-old baby and fly alongside demoiselle cranes as they attempt to cross the largest range on our planet, the Himalayas. The cranes, like all visitors to the hostile world of the high mountains, dare not linger.",https://ichef.bbci.co.uk/images/ic/1200x675/p05ccrb2.jpg
222,Science & Nature,A Perfect Planet - Series 1: 5. Humans,"BBC, iPlayer, TV, A Perfect Planet, Series 1: 5. Humans",,clean,"Humans are changing our planet so rapidly, it’s affecting earth’s life support systems.",3.0,58 mins,3484,3 Jan 2021,"Humans are changing our planet so rapidly, it’s affecting earth’s life support systems.","Humans are changing our planet so rapidly, it’s affecting earth’s life support systems: our weather, our oceans and the living world.","Earth is the only living world we know of, but a new force threatens our perfect planet. That force is us. Humans are changing our planet so rapidly, it’s affecting earth’s life support systems: our weather, our oceans and the living world. To understand what is going wrong, we must look to the past. Earth has been through at least five mass extinction events, most of which have been caused by cataclysmic volcanic eruptions. It’s not the lava or ash that wiped out life, but an invisible gas released by volcanoes: carbon dioxide. Through compelling animal-led stories and expert interviews, we discover how CO2 is destabilising our planet. We meet rescued orphaned elephants in Kenya, victims of ever worsening droughts, and join ocean patrols off the coast of Gabon fighting to save endangered sharks. In the Amazon, we witness wildlife teams saving animals in the shrinking forests, and in San Diego we enter a cryogenic zoo preserving the DNA of endangered species before they become extinct. Almost every part of modern life depends on energy created by burning fossil fuels, and this produces CO2 in huge amounts. Humans are now acting like a super-volcano, releasing carbon dioxide at an even greater rate than the prehistoric mega-eruptions that extinguished life in the past. Globally, we now release 100 times more carbon dioxide into the atmosphere than all of Earth's volcanoes combined.The greatest change to be made is in how we create energy, and the planet is brimming with natural power that can help us do just that. It’s these forces of nature - the wind, the sun, waves and geothermal energy - that hold the key to our future.",https://ichef.bbci.co.uk/images/ic/1200x675/p092423y.jpg
