showId,category,title,tags,age_rating,rating_description,description,representation,duration_txt,duration_sec,first_broadcast,synopsis_small,synopsis_medium,synopsis_large,image
46,Films,Versus - The Life and Films of Ken Loach,"BBC, iPlayer, TV, Versus - The Life and Films of Ken Loach",12,infrequent strong language,"Ken Loach reflects on his career, with comments from colleagues, friends and family.",1.0,90 mins,5371,2015,"Ken Loach reflects on his career, with comments from colleagues, friends and family.","Biographical documentary. Ken Loach reflects on his often controversial career, with comments from colleagues, friends and family.","Ken Loach, who has been making socially aware dramas and documentaries for over 50 years, reflects on his often controversial career, with comments from colleagues, friends and family. Successes like Cathy Come Home, Kes and Palm d'Or winning The Wind that Shakes the Barley are matched by tales of projects shelved or pilloried, a stage play cancelled during rehearsals, and a personal tragedy.",https://ichef.bbci.co.uk/images/ic/1200x675/p0b5vn0y.jpg
47,Films,Judy,"BBC, iPlayer, TV, Judy",12,"drug misuse, infrequent strong language",Judy Garland arrives in London in the winter of 1968 to perform a series of concerts.,3.0,109 mins,6513,2019,Judy Garland arrives in London in the winter of 1968 to perform a series of concerts.,Legendary performer Judy Garland arrives in London in the winter of 1968 to perform a series of sold-out concerts. From BBC Films.,No data found,https://ichef.bbci.co.uk/images/ic/1200x675/p0b8rsw6.jpg
49,Films,She Wore a Yellow Ribbon,"BBC, iPlayer, TV, She Wore a Yellow Ribbon",PG,mild violence,A US cavalry officer suffers a setback on his last mission. Starring John Wayne.,1.0,99 mins,5959,1949,A US cavalry officer suffers a setback on his last mission. Starring John Wayne.,"Western drama with John Wayne as a US cavalry officer on his last duty before retiring, escorting two women civilians to a stagecoach. The second in John Ford's cavalry trilogy.","In the second in John Ford's cavalry trilogy, a US cavalry officer suffers a setback on his last mission and is 'retired' before he can take further action. To avert a full-scale war, he decides to act alone.",https://ichef.bbci.co.uk/images/ic/1200x675/p08y06lt.jpg
50,Films,Man on the Moon,"BBC, iPlayer, TV, Man on the Moon",15,contains strong language,"Biopic of controversial comedian and star of Taxi and Saturday Night Live, Andy Kaufman.",3.0,110 mins,6578,1999,"Biopic of controversial comedian and star of Taxi and Saturday Night Live, Andy Kaufman.","Biopic of controversial comedian Andy Kaufman. Star of Taxi and Saturday Night Live, Kaufman's unorthodox humour was often misunderstood. With Jim Carrey and Courtney Love.","Biopic of controversial comedian Andy Kaufman, starring Jim Carrey. Star of Taxi and Saturday Night Live, Kaufman was a troubled individual for whom the boundaries of reality and stage performance were often blurred. Frequently misunderstood, even by those closest to him, he remained a strictly maverick entertainer until his untimely death from lung cancer in 1984.",https://ichef.bbci.co.uk/images/ic/1200x675/p05mwz8b.jpg
57,Films,Wallace and Gromit: A Close Shave,"BBC, iPlayer, TV, Wallace and Gromit: A Close Shave",U,clean,"While Wallace is distracted by a romance, Gromit is framed for sheep rustling.",,30 mins,1801,1995,"While Wallace is distracted by a romance, Gromit is framed for sheep rustling.","Oscar-winning animated comedy thriller. While Wallace is distracted by a romance with the local wool shop owner, Gromit is framed for sheep rustling in a fiendish criminal plot.","Oscar-winning claymation comedy thriller from Nick Park, featuring the popular inventor and his dog. Wallace's whirlwind romance with the proprietor of the local wool shop puts his head in a spin, and Gromit is framed for sheep rustling in a fiendish criminal plot, meeting a sheep named Shaun along the way. Will Wallace snap out of his daze in time to rescue his canine companion?",https://ichef.bbci.co.uk/images/ic/1200x675/p05jw5dy.jpg
62,Films,Mystify: Michael Hutchence,"BBC, iPlayer, TV, Mystify: Michael Hutchence",12,"moderate sex references, depression","An intimate portrait of Michael Hutchence, lead singer of INXS.",1.0,97 mins,5834,9:20pm 28 Dec 2019,"An intimate portrait of Michael Hutchence, lead singer of INXS.","A journey into the heart and soul of Michael Hutchence, internationally renowned lead-singer of INXS.","A journey into the heart and soul of Michael Hutchence, internationally renowned lead-singer of INXS, a complex and shy man who spent the bulk of his life in the public eye, rarely revealing his true self to anyone except his very close friends. Rare archive footage and intimate insights from friends, lovers, family, colleagues and Michael Hutchence himself, portray his life from the beginning of his fractured family background to the peaks of rock stardom and down into the depths after a freak accident in Copenhagen removed his sense of taste and smell and seriously affected his ability to deal with his unravelling personal and professional life.A feature-length theatrical documentary written and directed by Richard Lowenstein, director of the majority of both INXS and Michael’s music videos and the 1986 feature film, Dogs in Space, in which Michael played the lead.",https://ichef.bbci.co.uk/images/ic/1200x675/p07ycgpr.jpg
65,Films,"I, Tonya","BBC, iPlayer, TV, I, Tonya",15,"very strong language, domestic abuse","Seeking figure-skating success, Tonya Harding (Margot Robbie) instead finds notoriety.",3.0,111 mins,6660,2017,"Seeking figure-skating success, Tonya Harding (Margot Robbie) instead finds notoriety.","Darkly comic recreation of a sporting scandal. Seeking figure-skating success, Tonya Harding instead finds notoriety.","Seeking figure-skating success, Tonya Harding instead finds notoriety in this darkly comic recreation of a sporting scandal. Featuring a multi-award-winning performance from Allison Janney.",https://ichef.bbci.co.uk/images/ic/1200x675/p08r658w.jpg
66,Documentaries,Around the World in 80 Days - 7. Dateline to Deadline,"BBC, iPlayer, TV, Around the World in 80 Days, 7. Dateline to Deadline",PG,mild sex references,"With 22 days to go, delays, misunderstandings and a bomb impede Michael Palins journey.",3.0,49 mins,2930,9:30pm 22 Nov 1989,"With 22 days to go, delays, misunderstandings and a bomb impede Michael Palin's journey.","With only 22 days to go, delays, misunderstandings and a suspect bomb all conspire to impede Michael Palin's journey around the globe.",No data found,https://ichef.bbci.co.uk/images/ic/1200x675/p07nl4g5.jpg
67,Documentaries,Natural World - 2018-2019: 6. Humpback Whales: A Detective Story,"BBC, iPlayer, TV, Natural World, 2018-2019: 6. Humpback Whales: A Detective Story",U,clean,Documentary about our relationship with whales and their future alongside us.,,59 mins,3548,8 Feb 2019,Documentary about our relationship with whales and their future alongside us.,Nature documentary. Tom Mustill returns to California to find out whether the humpback whale that nearly killed him three years earlier was deliberately trying to hurt him.,"On 12 September 2015, a 30-ton humpback whale breached and landed on Tom Mustill and his friend Charlotte Kinloch as they paddled a sea kayak in Monterey Bay, California. Incredibly, both survived the incident, but the near-death experience haunted documentary maker Tom and left him wondering if the whale was deliberately trying to hurt them. To find the answer, Tom returned to California in 2018 to investigate. Tom meets those who have survived similar hair-raising encounters and the experts who know the whales best. What he discovers raises far bigger questions, not just about what happened that day but also about our relationship with whales and their future alongside us.",https://ichef.bbci.co.uk/images/ic/1200x675/p06zlc8r.jpg
74,Documentaries,A Perfect Planet - Series 1: 1. Volcano,"BBC, iPlayer, TV, A Perfect Planet, Series 1: 1. Volcano",U,clean,"A look at how without volcanoes, there would be no life on Earth.",,59 mins,3549,3 Jan 2021,"A look at how without volcanoes, there would be no life on Earth.","A look at how without volcanoes, there would be no life on Earth. Although destructive, magma from the planet’s molten core builds land, and mineral-rich ash from eruptions fertilises the surface.",No data found,https://ichef.bbci.co.uk/images/ic/1200x675/p09240nc.jpg
79,Documentaries,Big Cats - Series 1: Episode 1,"BBC, iPlayer, TV, Big Cats, Series 1: Episode 1",PG,scenes of animals hunting,"Meet the worlds ultimate cats, remarkable members of an incredible animal family.",,58 mins,3480,11 Jan 2018,"Meet the world's ultimate cats, remarkable members of an incredible animal family.","Documentary series uncovering the secret lives of cats. In Ruaha, Tanzania, lions form huge super prides in order to hunt giants.","In Ruaha, Tanzania, lions form huge super prides in order to hunt giants. Amongst cats lions are unusual, the only one to live in groups. In numbers they find the strength and audacity to hunt the most formidable prey.In Sri Lanka a tiny rusty-spotted cat explores his forest home - 200 times smaller than a lion, the rusty-spotted is the smallest of all cats, but just as curious.The Canada lynx lives further north than any cat, relying on snowshoe hares to survive the bitterly cold winters. Until now, lynx were creatures of mystery, but now technology provides an insightinto their secret lives.Predators they may be, but cats are also tender, intelligent and emotional. Honey is an African leopard and a mother. For a decade she's worn a radio collar that has allowed scientists to follow her life's every twist and turn. Now in the worst drought in decades, she's battling to raise a cub.In the Himalayas, perhaps the world's most lonesome cat is searching for a mate - a male snow leopard, who may get just one chance to mate in his whole life.Cats are naturally secretive, elusive and cryptic animals. Only now have the latest developments in filming technology, and a surge in cat research, enabled us to bring the cat superstars out of the shadows.",https://ichef.bbci.co.uk/images/ic/1200x675/p08jjf8p.jpg
82,Documentaries,Fraud Squad - Series 4: Episode 6,"BBC, iPlayer, TV, Fraud Squad, Series 4: Episode 6",12,"moderate bad language, sex references, threat, violence",A leading academic steals nearly £3 million of grants meant for environmental research.,3.0,44 mins,2618,10am 22 Feb 2022,A leading academic steals nearly £3 million of grants meant for environmental research.,"An academic steals millions meant for environmental research, a council fights back against fraudulent compensation claims, and a conman steals £10,000 meant for Covid-19 support.","A leading Cambridge academic steals nearly £3 million of government grants meant for environmental research, then smuggles bundles of cash out of the country inside empty chocolate boxes. A local council fights back against fraudulent compensation claims that could cripple its budget, and a fraudster abuses the Covid-19 support scheme to line their own pockets with £10,000, stolen from the public purse.",https://ichef.bbci.co.uk/images/ic/1200x675/p0bpmts3.jpg
85,Documentaries,The Mating Game - Series 1: 4. Freshwater: Timing Is Everything,"BBC, iPlayer, TV, The Mating Game, Series 1: 4. Freshwater: Timing Is Everything",PG,animals mating,The cycle of freshwater triggers spectacular mating rituals and fierce competition.,,58 mins,3476,8pm 24 Oct 2021,The cycle of freshwater triggers spectacular mating rituals and fierce competition.,"Freshwater is often the stage on which millions of animals gather to find a mate, and the cycle of freshwater is the trigger for spectacular mating rituals and fierce competition.","Freshwater covers only a tiny fraction of the earth’s surface, but it is a vital meeting place for many animals - the stage on which millions gather to find a mate. Yet with so little of it available, and often only briefly, the challenge for most individuals is how to overcome intense competition when your rivals are just as dependent on the precious freshwater for their success. Whether it is from melting ice, torrential rain or shrinking wetlands, the cycle of freshwater is the trigger for spectacular mating rituals and fierce combat.The start of the rains in South Africa triggers a violent battle between male giant African bullfrogs. Rare hooded grebes in Patagonia perform one of nature’s more comical dances to seduce their partner, and a male cichlid fish builds a home for his harem from old snail shells, but a sneaky dwarf has the last laugh there.The mating season for animals that live in freshwater is often determined by when is best for their new offspring - even if that moment is far from ideal for the parents. In the wetlands of Zambia, female lechwe antelope search for the strongest males while contending with drought, and in the Pantanal of Brazil at the end of the dry season, caimans congregate in huge numbers around the last remaining water to perform their spectacular displays.For all those dependent on the cycle of freshwater to breed, timing is everything.",https://ichef.bbci.co.uk/images/ic/1200x675/p09z41sr.jpg
87,Documentaries,Natural World - Short Versions: Raising Sancho,"BBC, iPlayer, TV, Natural World, Short Versions: Raising Sancho",U,clean,The touching story of a rescued giant otter cub being raised by a Brazilian naturalist.,,4 mins,253,5 Aug 2020,The touching story of a rescued giant otter cub being raised by a Brazilian naturalist.,Wildlife documentary. The touching story of a giant otter cub called Sancho who was rescued and is being raised by Brazilian naturalist Carolina Vargas.,No data found,https://ichef.bbci.co.uk/images/ic/1200x675/p08ynk96.jpg
88,Documentaries,One Pair of Eyes - Georgia Brown: Who Are the Cockneys Now?,"BBC, iPlayer, TV, One Pair of Eyes, Georgia Brown: Who Are the Cockneys Now?",PG,language,"Singer and actress Georgia Brown revisits her old home in Whitechapel, East London. (1968)",1.0,42 mins,2530,17 Aug 1968,"Singer and actress Georgia Brown revisits her old home in Whitechapel, East London. (1968)","First transmitted in 1968, Georgia Brown revisits her childhood Whitechapel home to see how the Jewish community is coming to terms with a more diverse immigrant population.","First transmitted in 1968, singer and actress Georgia Brown revisits her old childhood home in Whitechapel, East London and notes the fading presence of the Jewish immigrant community. Brown discusses the recent change in the area's increasingly diverse population and ponders the question, ""Who are the cockneys now?""",https://ichef.bbci.co.uk/images/ic/1200x675/p01hhbxx.jpg
89,Documentaries,Wonders of the Celtic Deep - Series 1: Episode 2,"BBC, iPlayer, TV, Wonders of the Celtic Deep, Series 1: Episode 2",U,clean,The world of the shallow seas is one of the richest and most productive on earth.,,58 mins,3493,12 Oct 2021,The world of the shallow seas is one of the richest and most productive on earth.,"The strange environment of the shallow seas is one that sits remarkably close to shore. In the giant kelp forest, we join a female catshark as she lays an egg deep in the forest floor.","The world of the shallow seas is one of the richest and most productive on earth, with an array of diverse wildlife habitats populated by a myriad of bizarre characters, seemingly straight from the pages of Welsh mythology.  We journey into this strange environment - one that sits remarkably close to shore. In the giant kelp forest, we join a female catshark as she lays an egg deep in the forest floor and watch as we witness a tangled web of hermaphrodite sea hares taking part in a three-day ‘love-athon’.   On the dramatic underwater cliffs off Pembrokeshire, we find the Great Barrier Reef of Wales, chocked with exotic gardens of sponges and soft corals. The alien-like predators on this rocky landscape include a rare spiny lobster and a large star fish, making a stealth attack on a hapless-looking scallop with a surprise up his sleeve.   Just beyond the beaches of Abersoch, an underwater desert stretches out to sea. With nowhere to hide, many marine inhabitants have found incredible ways to camouflage themselves from the visiting catshark. Meanwhile a gang of painted goby use extraordinary drum-like vocalisations to attract a female.   In Anglesey, Arctic terns have arrived to breed. These elegant sea birds have the longest migration of any bird on earth. They spend the summer fishing in the shallows to feed their young. On the wreck of the SS Gwynfaen, we meet a range of colourful and exciting characters including a three-meter-long conger eel.",https://ichef.bbci.co.uk/images/ic/1200x675/p09xt6zg.jpg
90,Documentaries,Living Differently - Series 5: 2. My Life With Half A Body,"BBC, iPlayer, TV, Living Differently, Series 5: 2. My Life With Half A Body",U,clean,Piyah was born with half a body and male and has now transitioned to female.,3.0,8 mins,467,29 Apr 2019,Piyah was born with half a body and male and has now transitioned to female.,Piyah was born with Sacral Agenesis - meaning she has only half a body. Piyah was born male and has now transitioned to female.,"Piyah was born with Sacral Agenesis - meaning she has only half a body. Piyah was born male and has now transitioned to female. She has had to overcome bullying and rejection because of her identity and appearance. Despite being judged all her life, she has recently found love with boyfriend Andrew, who calls her his ‘angel’. Even though she has no lower half, the 27-year-old trans woman gets around on a skateboard. She has built a physical and mental strength and now spends most of her life encouraging more LGBTQ, disabled women to embrace themselves and life – just like she does.",https://ichef.bbci.co.uk/images/ic/1200x675/p077rmxq.jpg
91,From the Archives,Waterloo Road - Series 9: Episode 20,"BBC, iPlayer, TV, Waterloo Road, Series 9: Episode 20",12,"moderate language, violence, references to sex, suicide",Kaceys boxing career is jeopardised when a challenge by Gabriella goes horribly wrong.,3.0,57 mins,3413,8pm 12 Mar 2014,Kacey's boxing career is jeopardised when a challenge by Gabriella goes horribly wrong.,School-based drama. Kacey's boxing career is jeopardised when a challenge by Gabriella goes horribly wrong. Simon turns to Christine when he finds himself unable to cope.,Kacey's boxing career is jeopardised when a challenge by Gabriella goes horribly wrong.Simon turns to Christine when he finds himself unable to cope with the challenges of Acting Head.,https://ichef.bbci.co.uk/images/ic/1200x675/p01thb59.jpg
93,From the Archives,Doctor Who - Series 11: 8. The Witchfinders,"BBC, iPlayer, TV, Doctor Who, Series 11: 8. The Witchfinders",12,mild threat,The Doctor and friends encounter a witch trial and King James I in the 17th century.,3.0,47 mins,2791,6:30pm 25 Nov 2018,The Doctor and friends encounter a witch trial and King James I in the 17th century.,"In 17th-century Lancashire, the Doctor, Yaz, Ryan and Graham become embroiled in a witch trial and the arrival of King James I.","The Doctor, Ryan, Graham and Yaz arrive in 17th-century Lancashire and become embroiled in a witch trial, run by the local landowner. As fear stalks the land, the arrival of King James I only serves to intensify the witch hunt. But is there something even more dangerous at work? Can the Doctor and friends keep the people of Bilehurst Cragg safe from all the forces that are massing in the land?",https://ichef.bbci.co.uk/images/ic/1200x675/p06sby6v.jpg
104,From the Archives,Top Gear - Series 6: Episode 11,"BBC, iPlayer, TV, Top Gear, Series 6: Episode 11",15,"contains mild violence, language",Does a Lamborghini Murcielago roadster give the same kick as 12 angry bulls?,1.0,59 mins,3554,7 Aug 2005,Does a Lamborghini Murcielago roadster give the same kick as 12 angry bulls?,The team find out if driving a Lamborghini Murcielago roadster gives the same kick as 12 angry bulls.,The team find out if driving a Lamborghini Murcielago roadster gives the same kick as 12 angry bulls the world's greatest power sliders grace the track and a look at the Ford F150 SVT Lightning pick-up. Timothy Spall is this week's 'Star in a Reasonably Priced Car'.,https://ichef.bbci.co.uk/images/ic/1200x675/p09t5q2w.jpg
105,From the Archives,Heroes - Series 3: 8. Villains,"BBC, iPlayer, TV, Heroes, Series 3: 8. Villains",15,"strong bloody violence, horror",Hiro tries to discover what drove Arthur Petrelli to create Pinehearst.,3.0,41 mins,2448,12 Nov 2008,Hiro tries to discover what drove Arthur Petrelli to create Pinehearst.,Drama series about people with superpowers. Hiro tries to discover what drove Arthur Petrelli to create Pinehearst and strike at Angela before he died.,"Drama series in which people all over the world deal with their newly discovered superpowers. Hiro follows respected businessman, husband and father Arthur Petrelli in the days before he died, to discover what drove him to create Pinehearst and strike at Angela. Later, a moment unfolds where Sylar, horrified and guilt-ridden, might have stopped his murderous pursuit of abilities if H.R.G. and Elle had swayed from their monstrous assignment.",https://ichef.bbci.co.uk/images/ic/1200x675/p08l06f8.jpg
112,From the Archives,One Foot in the Grave - Series 5: 5. Hole in the Sky,"BBC, iPlayer, TV, One Foot in the Grave, Series 5: 5. Hole in the Sky",12,satire,"Margaret comes into some money, and Victor helps a young Dutch girl get back on her feet.",1.0,29 mins,1728,9:05pm 22 Jan 1995,"Margaret comes into some money, and Victor helps a young Dutch girl get back on her feet.","Award-winning sitcom about a grumpy senior citizen. Margaret comes into some money, and Victor helps a young Dutch girl to get back on her feet.","Sitcom about a grumpy senior citizen. Margaret comes into some money, and Victor helps a young Dutch girl to get back on her feet. To add to the usual mayhem, the builders arrive to embark on a loft conversion.",https://ichef.bbci.co.uk/images/ic/1200x675/p09wnl6b.jpg
122,Sports,The FA Cup - 2021/22: Quarter-Final: Middlesbrough v Chelsea,"BBC, iPlayer, TV, The FA Cup, 2021/22: Quarter-Final: Middlesbrough v Chelsea",U,clean,Live coverage of the quarter-final match from the Riverside Stadium.,,154 mins,9240,4:55pm 19 Mar 2022,Live coverage of the quarter-final match from the Riverside Stadium.,Live coverage of the quarter-final match from the Riverside Stadium as Middlesbrough host Chelsea.,Live coverage of the quarter-final match from the Riverside Stadium as Middlesbrough host Chelsea.,https://ichef.bbci.co.uk/images/ic/1200x675/p0bvmlh4.jpg
141,Entertainment,Top Gear - Series 4: Episode 8,"BBC, iPlayer, TV, Top Gear, Series 4: Episode 8",15,contains mild violence and language,"The trio test a Ford GT40, Maserati Quattroporte and Toyota Prius. With Martin Clunes.",1.0,59 mins,3534,8pm 18 Jul 2004,"The trio test a Ford GT40, Maserati Quattroporte and Toyota Prius. With Martin Clunes.","The trio look at the new Ford GT40, Maserati Quattroporte and Toyota Prius, and have a diesel versus petrol hot hatch race. Martin Clunes is this week�s guest star.","The trio look at the new Ford GT40, Maserati Quattroporte and Toyota Prius, and have a diesel versus petrol hot hatch race. Martin Clunes is this week�s guest star.",https://ichef.bbci.co.uk/images/ic/1200x675/p09t2d3c.jpg
143,Entertainment,Would I Lie to You? - Series 15: Episode 1,"BBC, iPlayer, TV, Would I Lie to You?, Series 15: Episode 1",12,"contains mild language, sex references and innuendo","With guests John Cooper Clarke, Judi Love, Chris McCausland and Caroline Quentin.",3.0,29 mins,1736,8:30pm 7 Jan 2022,"With guests John Cooper Clarke, Judi Love, Chris McCausland and Caroline Quentin.","Sorting the fact from fiction this week are guests John Cooper Clarke, Judi Love, Chris McCausland and Caroline Quentin.","Rob Brydon is back in the host�s chair for the award-winning comedy panel show, with Lee Mack and David Mitchell returning as team captains. Sorting the fact from fiction this week are guests John Cooper Clarke, Judi Love, Chris McCausland and Caroline Quentin.",https://ichef.bbci.co.uk/images/ic/1200x675/p0bcrthn.jpg
144,Entertainment,Michael McIntyre's The Wheel - Series 2: Episode 7,"BBC, iPlayer, TV, Michael McIntyres The Wheel, Series 2: Episode 7",15,contains strong language,"Mel B, Josh Widdicombe and Osi Umenyiora try to help the contestants win a fortune.",3.0,59 mins,3565,7:40pm 4 Dec 2021,"Mel B, Josh Widdicombe and Osi Umenyiora try to help the contestants win a fortune.","Michael McIntyre hosts as Mel B, Josh Widdicombe, Osi Umenyiora, Kerry Godliman, Jordan North, Rosemary Shrager and Dr Hilary Jones try to help the contestants win a life-changing cash prize.","Bafta award-winning Michael McIntyre is back with his hit Saturday night game show packed with huge stars, big laughs, and a colossal spinning wheel! Three contestants hope to answer their way to a fortune, guided by seven celebrities, but can they help them to win life-changing cash? That all depends on the spin of The Wheel. Celebrities on The Wheel tonight: Mel B, Josh Widdicombe, Osi Umenyiora, Kerry Godliman, Jordan North, Rosemary Shrager and Dr Hilary Jones.",https://ichef.bbci.co.uk/images/ic/1200x675/p0b6jnsz.jpg
